PMID,Title,Authors,Citation,First Author,Journal/Book,Publication Year,Create Date,PMCID,NIHMS ID,DOI
"24164166","Graphs of brain networks","Zahr NM.","Alcohol Clin Exp Res. 2013 Nov;37(11):1813-5. doi: 10.1111/acer.12293.","Zahr NM","Alcohol Clin Exp Res","2013","2013/10/30","PMC8146133","NIHMS1699229","10.1111/acer.12293"
"28161319","Biophysical and neural basis of resting state functional connectivity: Evidence from non-human primates","Chen LM, Yang PF, Wang F, Mishra A, Shi Z, Wu R, Wu TL, Wilson GH 3rd, Ding Z, Gore JC.","Magn Reson Imaging. 2017 Jun;39:71-81. doi: 10.1016/j.mri.2017.01.020. Epub 2017 Feb 2.","Chen LM","Magn Reson Imaging","2017","2017/02/06","PMC5410395","NIHMS852391","10.1016/j.mri.2017.01.020"
"29352154","Resting state brain networks in the prairie vole","Ortiz JJ, Portillo W, Paredes RG, Young LJ, Alcauter S.","Sci Rep. 2018 Jan 19;8(1):1231. doi: 10.1038/s41598-017-17610-9.","Ortiz JJ","Sci Rep","2018","2018/01/21","PMC5775431","","10.1038/s41598-017-17610-9"
"28716961","Structural Basis of Large-Scale Functional Connectivity in the Mouse","Grandjean J, Zerbi V, Balsters JH, Wenderoth N, Rudin M.","J Neurosci. 2017 Aug 23;37(34):8092-8101. doi: 10.1523/JNEUROSCI.0438-17.2017. Epub 2017 Jul 17.","Grandjean J","J Neurosci","2017","2017/07/19","PMC6596781","","10.1523/JNEUROSCI.0438-17.2017"
"31219563","From Synchrony to Asynchrony: Cerebellar-Basal Ganglia Functional Circuits in Young and Older Adults","Hausman HK, Jackson TB, Goen JRM, Bernard JA.","Cereb Cortex. 2020 Mar 21;30(2):718-729. doi: 10.1093/cercor/bhz121.","Hausman HK","Cereb Cortex","2020","2019/06/21","","","10.1093/cercor/bhz121"
"27587999","Off to a Good Start: The Early Development of the Neural Substrates Underlying Visual Working Memory","Fitch A, Smith H, Guillory SB, Kaldy Z.","Front Syst Neurosci. 2016 Aug 18;10:68. doi: 10.3389/fnsys.2016.00068. eCollection 2016.","Fitch A","Front Syst Neurosci","2016","2016/09/03","PMC4989029","","10.3389/fnsys.2016.00068"
"27596024","Resting state network topology of the ferret brain","Zhou ZC, Salzwedel AP, Radtke-Schuller S, Li Y, Sellers KK, Gilmore JH, Shih YY, Fröhlich F, Gao W.","Neuroimage. 2016 Dec;143:70-81. doi: 10.1016/j.neuroimage.2016.09.003. Epub 2016 Sep 2.","Zhou ZC","Neuroimage","2016","2016/09/07","PMC5124532","NIHMS817278","10.1016/j.neuroimage.2016.09.003"
"30926817","Intrinsic functional architecture of the non-human primate spinal cord derived from fMRI and electrophysiology","Wu TL, Yang PF, Wang F, Shi Z, Mishra A, Wu R, Chen LM, Gore JC.","Nat Commun. 2019 Mar 29;10(1):1416. doi: 10.1038/s41467-019-09485-3.","Wu TL","Nat Commun","2019","2019/03/31","PMC6440970","","10.1038/s41467-019-09485-3"
"27439860","Constituents and functional implications of the rat default mode network","Hsu LM, Liang X, Gu H, Brynildsen JK, Stark JA, Ash JA, Lin CP, Lu H, Rapp PR, Stein EA, Yang Y.","Proc Natl Acad Sci U S A. 2016 Aug 2;113(31):E4541-7. doi: 10.1073/pnas.1601485113. Epub 2016 Jul 20.","Hsu LM","Proc Natl Acad Sci U S A","2016","2016/07/22","PMC4978262","","10.1073/pnas.1601485113"
"30419289","Intrinsic functional clustering of anterior cingulate cortex in the common marmoset","Schaeffer DJ, Gilbert KM, Ghahremani M, Gati JS, Menon RS, Everling S.","Neuroimage. 2019 Feb 1;186:301-307. doi: 10.1016/j.neuroimage.2018.11.005. Epub 2018 Nov 10.","Schaeffer DJ","Neuroimage","2019","2018/11/13","","","10.1016/j.neuroimage.2018.11.005"
"25970649","Functional subdivisions of medial parieto-occipital cortex in humans and nonhuman primates using resting-state fMRI","Hutchison RM, Culham JC, Flanagan JR, Everling S, Gallivan JP.","Neuroimage. 2015 Aug 1;116:10-29. doi: 10.1016/j.neuroimage.2015.04.068. Epub 2015 May 10.","Hutchison RM","Neuroimage","2015","2015/05/14","","","10.1016/j.neuroimage.2015.04.068"
"26290449","Resting-state functional connectivity in the baboon model of genetic generalized epilepsy","Salinas FS, Szabó CÁ.","Epilepsia. 2015 Oct;56(10):1580-9. doi: 10.1111/epi.13115. Epub 2015 Aug 20.","Salinas FS","Epilepsia","2015","2015/08/21","PMC4593742","NIHMS708606","10.1111/epi.13115"
"29496614","Segregation of the human basal forebrain using resting state functional MRI","Markello RD, Spreng RN, Luh WM, Anderson AK, De Rosa E.","Neuroimage. 2018 Jun;173:287-297. doi: 10.1016/j.neuroimage.2018.02.042. Epub 2018 Feb 26.","Markello RD","Neuroimage","2018","2018/03/03","","","10.1016/j.neuroimage.2018.02.042"
"26467643","Essential tremor is associated with disruption of functional connectivity in the ventral intermediate Nucleus--Motor Cortex--Cerebellum circuit","Fang W, Chen H, Wang H, Zhang H, Puneet M, Liu M, Lv F, Luo T, Cheng O, Wang X, Lu X.","Hum Brain Mapp. 2016 Jan;37(1):165-78. doi: 10.1002/hbm.23024. Epub 2015 Oct 15.","Fang W","Hum Brain Mapp","2016","2015/10/16","PMC6867464","","10.1002/hbm.23024"
"22855672","Monkey in the middle: why non-human primates are needed to bridge the gap in resting-state investigations","Hutchison RM, Everling S.","Front Neuroanat. 2012 Jul 26;6:29. doi: 10.3389/fnana.2012.00029. eCollection 2012.","Hutchison RM","Front Neuroanat","2012","2012/08/03","PMC3405297","","10.3389/fnana.2012.00029"
"27451405","Effects of anesthesia on resting state BOLD signals in white matter of non-human primates","Wu TL, Wang F, Anderson AW, Chen LM, Ding Z, Gore JC.","Magn Reson Imaging. 2016 Nov;34(9):1235-1241. doi: 10.1016/j.mri.2016.07.001. Epub 2016 Jul 20.","Wu TL","Magn Reson Imaging","2016","2016/07/25","PMC5055423","NIHMS804667","10.1016/j.mri.2016.07.001"
