PMID,Title,Authors,Citation,First Author,Journal/Book,Publication Year,Create Date,PMCID,NIHMS ID,DOI
"31731911","Cingulate role in Tourette syndrome","O'Neill J, Piacentini JC, Peterson BS.","Handb Clin Neurol. 2019;166:165-221. doi: 10.1016/B978-0-444-64196-0.00011-X.","O'Neill J","Handb Clin Neurol","2019","2019/11/17","","","10.1016/B978-0-444-64196-0.00011-X"
"28161319","Biophysical and neural basis of resting state functional connectivity: Evidence from non-human primates","Chen LM, Yang PF, Wang F, Mishra A, Shi Z, Wu R, Wu TL, Wilson GH 3rd, Ding Z, Gore JC.","Magn Reson Imaging. 2017 Jun;39:71-81. doi: 10.1016/j.mri.2017.01.020. Epub 2017 Feb 2.","Chen LM","Magn Reson Imaging","2017","2017/02/06","PMC5410395","NIHMS852391","10.1016/j.mri.2017.01.020"
"33127411","Effects of alfaxalone on cerebral blood flow and intrinsic neural activity of rhesus monkeys: A comparison study with ketamine","Li CX, Kempf D, Howell L, Zhang X.","Magn Reson Imaging. 2021 Jan;75:134-140. doi: 10.1016/j.mri.2020.10.011. Epub 2020 Oct 27.","Li CX","Magn Reson Imaging","2021","2020/10/31","PMC7733545","NIHMS1643371","10.1016/j.mri.2020.10.011"
"30926817","Intrinsic functional architecture of the non-human primate spinal cord derived from fMRI and electrophysiology","Wu TL, Yang PF, Wang F, Shi Z, Mishra A, Wu R, Chen LM, Gore JC.","Nat Commun. 2019 Mar 29;10(1):1416. doi: 10.1038/s41467-019-09485-3.","Wu TL","Nat Commun","2019","2019/03/31","PMC6440970","","10.1038/s41467-019-09485-3"
"30178424","Joint representation of connectome-scale structural and functional profiles for identification of consistent cortical landmarks in macaque brain","Zhang S, Jiang X, Zhang W, Zhang T, Chen H, Zhao Y, Lv J, Guo L, Howell BR, Sanchez MM, Hu X, Liu T.","Brain Imaging Behav. 2019 Oct;13(5):1427-1443. doi: 10.1007/s11682-018-9944-7.","Zhang S","Brain Imaging Behav","2019","2018/09/05","PMC6399084","NIHMS1505800","10.1007/s11682-018-9944-7"
"28461059","High-resolution functional MRI identified distinct global intrinsic functional networks of nociceptive posterior insula and S2 regions in squirrel monkey brain","Wu R, Wang F, Yang PF, Chen LM.","Neuroimage. 2017 Jul 15;155:147-158. doi: 10.1016/j.neuroimage.2017.04.067. Epub 2017 Apr 28.","Wu R","Neuroimage","2017","2017/05/03","PMC6104393","NIHMS983774","10.1016/j.neuroimage.2017.04.067"
"28755862","Ketamine changes the local resting-state functional properties of anesthetized-monkey brain","Rao JS, Liu Z, Zhao C, Wei RH, Zhao W, Tian PY, Zhou X, Yang ZY, Li XG.","Magn Reson Imaging. 2017 Nov;43:144-150. doi: 10.1016/j.mri.2017.07.025. Epub 2017 Jul 26.","Rao JS","Magn Reson Imaging","2017","2017/07/31","","","10.1016/j.mri.2017.07.025"
"30530862","Intrinsic Functional Boundaries of Lateral Frontal Cortex in the Common Marmoset Monkey","Schaeffer DJ, Gilbert KM, Gati JS, Menon RS, Everling S.","J Neurosci. 2019 Feb 6;39(6):1020-1029. doi: 10.1523/JNEUROSCI.2595-18.2018. Epub 2018 Dec 10.","Schaeffer DJ","J Neurosci","2019","2018/12/12","PMC6363921","","10.1523/JNEUROSCI.2595-18.2018"
"22855672","Monkey in the middle: why non-human primates are needed to bridge the gap in resting-state investigations","Hutchison RM, Everling S.","Front Neuroanat. 2012 Jul 26;6:29. doi: 10.3389/fnana.2012.00029. eCollection 2012.","Hutchison RM","Front Neuroanat","2012","2012/08/03","PMC3405297","","10.3389/fnana.2012.00029"
