PMID,Title,Authors,Citation,First Author,Journal/Book,Publication Year,Create Date,PMCID,NIHMS ID,DOI
"33757907","Examining cross-modal fMRI adaptation for observed and executed actions in the monkey brain","Cui D, Nelissen K.","Neuroimage. 2021 Jun;233:117988. doi: 10.1016/j.neuroimage.2021.117988. Epub 2021 Mar 20.","Cui D","Neuroimage","2021","2021/03/24","","","10.1016/j.neuroimage.2021.117988"
"33484849","The nonhuman primate neuroimaging and neuroanatomy project","Hayashi T, Hou Y, Glasser MF, Autio JA, Knoblauch K, Inoue-Murayama M, Coalson T, Yacoub E, Smith S, Kennedy H, Van Essen DC.","Neuroimage. 2021 Apr 1;229:117726. doi: 10.1016/j.neuroimage.2021.117726. Epub 2021 Jan 20.","Hayashi T","Neuroimage","2021","2021/01/23","PMC8079967","NIHMS1688396","10.1016/j.neuroimage.2021.117726"
"33137475","The macaque brain ONPRC18 template with combined gray and white matter labelmap for multimodal neuroimaging studies of Nonhuman Primates","Weiss AR, Liu Z, Wang X, Liguore WA, Kroenke CD, McBride JL.","Neuroimage. 2021 Jan 15;225:117517. doi: 10.1016/j.neuroimage.2020.117517. Epub 2020 Nov 1.","Weiss AR","Neuroimage","2021","2020/11/02","PMC7833476","NIHMS1659147","10.1016/j.neuroimage.2020.117517"
"33122437","Differential functional connectivity underlying asymmetric reward-related activity in human and nonhuman primates","Lopez-Persem A, Roumazeilles L, Folloni D, Marche K, Fouragnan EF, Khalighinejad N, Rushworth MFS, Sallet J.","Proc Natl Acad Sci U S A. 2020 Nov 10;117(45):28452-28462. doi: 10.1073/pnas.2000759117. Epub 2020 Oct 29.","Lopez-Persem A","Proc Natl Acad Sci U S A","2020","2020/10/30","PMC7668182","","10.1073/pnas.2000759117"
"33112698","Whole brain mapping of somatosensory responses in awake marmosets investigated with ultra-high-field fMRI","Cléry JC, Hori Y, Schaeffer DJ, Gati JS, Pruszynski JA, Everling S.","J Neurophysiol. 2020 Dec 1;124(6):1900-1913. doi: 10.1152/jn.00480.2020. Epub 2020 Oct 28.","Cléry JC","J Neurophysiol","2020","2020/10/28","","","10.1152/jn.00480.2020"
"32928886","Parallel Processing of Facial Expression and Head Orientation in the Macaque Brain","Taubert J, Japee S, Murphy AP, Tardiff CT, Koele EA, Kumar S, Leopold DA, Ungerleider LG.","J Neurosci. 2020 Oct 14;40(42):8119-8131. doi: 10.1523/JNEUROSCI.0524-20.2020. Epub 2020 Sep 14.","Taubert J","J Neurosci","2020","2020/09/15","PMC7574659","","10.1523/JNEUROSCI.0524-20.2020"
"32898683","Ultra-high field (10.5 T) resting state fMRI in the macaque","Yacoub E, Grier MD, Auerbach EJ, Lagore RL, Harel N, Adriany G, Zilverstand A, Hayden BY, Heilbronner SR, Uğurbil K, Zimmermann J.","Neuroimage. 2020 Dec;223:117349. doi: 10.1016/j.neuroimage.2020.117349. Epub 2020 Sep 6.","Yacoub E","Neuroimage","2020","2020/09/08","PMC7745777","NIHMS1651795","10.1016/j.neuroimage.2020.117349"
"32818615","Evolutional and developmental anatomical architecture of the left inferior frontal gyrus","Wang J, Yang Y, Zhao X, Zuo Z, Tan LH.","Neuroimage. 2020 Nov 15;222:117268. doi: 10.1016/j.neuroimage.2020.117268. Epub 2020 Aug 18.","Wang J","Neuroimage","2020","2020/08/21","","","10.1016/j.neuroimage.2020.117268"
"32541016","Auditory representation of learned sound sequences in motor regions of the macaque brain","Archakov D, DeWitt I, Kuśmierek P, Ortiz-Rios M, Cameron D, Cui D, Morin EL, VanMeter JW, Sams M, Jääskeläinen IP, Rauschecker JP.","Proc Natl Acad Sci U S A. 2020 Jun 30;117(26):15242-15252. doi: 10.1073/pnas.1915610117. Epub 2020 Jun 15.","Archakov D","Proc Natl Acad Sci U S A","2020","2020/06/17","PMC7334521","","10.1073/pnas.1915610117"
"32439858","Long-term alterations in brain and behavior after postnatal Zika virus infection in infant macaques","Raper J, Kovacs-Balint Z, Mavigner M, Gumber S, Burke MW, Habib J, Mattingly C, Fair D, Earl E, Feczko E, Styner M, Jean SM, Cohen JK, Suthar MS, Sanchez MM, Alvarado MC, Chahroudi A.","Nat Commun. 2020 May 21;11(1):2534. doi: 10.1038/s41467-020-16320-7.","Raper J","Nat Commun","2020","2020/05/23","PMC7242369","","10.1038/s41467-020-16320-7"
"32053769","Thalamus Modulates Consciousness via Layer-Specific Control of Cortex","Redinbaugh MJ, Phillips JM, Kambi NA, Mohanta S, Andryk S, Dooley GL, Afrasiabi M, Raz A, Saalmann YB.","Neuron. 2020 Apr 8;106(1):66-75.e12. doi: 10.1016/j.neuron.2020.01.005. Epub 2020 Feb 12.","Redinbaugh MJ","Neuron","2020","2020/02/14","PMC7243351","NIHMS1569336","10.1016/j.neuron.2020.01.005"
"31871175","Cerebral cortical folding, parcellation, and connectivity in humans, nonhuman primates, and mice","Van Essen DC, Donahue CJ, Coalson TS, Kennedy H, Hayashi T, Glasser MF.","Proc Natl Acad Sci U S A. 2019 Dec 23;116(52):26173-80. doi: 10.1073/pnas.1902299116. Online ahead of print.","Van Essen DC","Proc Natl Acad Sci U S A","2019","2019/12/25","PMC6936571","","10.1073/pnas.1902299116"
"31743789","Pypreclin: An automatic pipeline for macaque functional MRI preprocessing","Tasserie J, Grigis A, Uhrig L, Dupont M, Amadon A, Jarraya B.","Neuroimage. 2020 Feb 15;207:116353. doi: 10.1016/j.neuroimage.2019.116353. Epub 2019 Nov 16.","Tasserie J","Neuroimage","2020","2019/11/20","","","10.1016/j.neuroimage.2019.116353"
"31732670","Body map proto-organization in newborn macaques","Arcaro MJ, Schade PF, Livingstone MS.","Proc Natl Acad Sci U S A. 2019 Dec 3;116(49):24861-24871. doi: 10.1073/pnas.1912636116. Epub 2019 Nov 15.","Arcaro MJ","Proc Natl Acad Sci U S A","2019","2019/11/17","PMC6900594","","10.1073/pnas.1912636116"
"30925163","Areal differences in depth cue integration between monkey and human","Armendariz M, Ban H, Welchman AE, Vanduffel W.","PLoS Biol. 2019 Mar 29;17(3):e2006405. doi: 10.1371/journal.pbio.2006405. eCollection 2019 Mar.","Armendariz M","PLoS Biol","2019","2019/03/30","PMC6457573","","10.1371/journal.pbio.2006405"
"30395192","Homology and Specificity of Natural Sound-Encoding in Human and Monkey Auditory Cortex","Erb J, Armendariz M, De Martino F, Goebel R, Vanduffel W, Formisano E.","Cereb Cortex. 2019 Aug 14;29(9):3636-3650. doi: 10.1093/cercor/bhy243.","Erb J","Cereb Cortex","2019","2018/11/06","","","10.1093/cercor/bhy243"
"30355629","Functional MRI in Macaque Monkeys during Task Switching","Premereur E, Janssen P, Vanduffel W.","J Neurosci. 2018 Dec 12;38(50):10619-10630. doi: 10.1523/JNEUROSCI.1539-18.2018. Epub 2018 Oct 24.","Premereur E","J Neurosci","2018","2018/10/26","PMC6580658","","10.1523/JNEUROSCI.1539-18.2018"
"30272135","Early Developmental Trajectories of Functional Connectivity Along the Visual Pathways in Rhesus Monkeys","Kovacs-Balint Z, Feczko E, Pincus M, Earl E, Miranda-Dominguez O, Howell B, Morin E, Maltbie E, Li L, Steele J, Styner M, Bachevalier J, Fair D, Sanchez M.","Cereb Cortex. 2019 Jul 22;29(8):3514-3526. doi: 10.1093/cercor/bhy222.","Kovacs-Balint Z","Cereb Cortex","2019","2018/10/02","PMC6644858","","10.1093/cercor/bhy222"
"30099461","Comparative Primate Connectomics","Rilling JK, van den Heuvel MP.","Brain Behav Evol. 2018;91(3):170-179. doi: 10.1159/000488886. Epub 2018 Aug 10.","Rilling JK","Brain Behav Evol","2018","2018/08/13","","","10.1159/000488886"
"28935007","An International Survey of Approaches to Chair Restraint of Nonhuman Primates","McMillan JL, Bloomsmith MA, Prescott MJ.","Comp Med. 2017 Oct 1;67(5):442-451.","McMillan JL","Comp Med","2017","2017/09/23","PMC5621573","",""
"28660250","Shape Selectivity of Middle Superior Temporal Sulcus Body Patch Neurons","Kalfas I, Kumar S, Vogels R.","eNeuro. 2017 Jun 27;4(3):ENEURO.0113-17.2017. doi: 10.1523/ENEURO.0113-17.2017. eCollection 2017 May-Jun.","Kalfas I","eNeuro","2017","2017/06/30","PMC5485377","","10.1523/ENEURO.0113-17.2017"
"27371764","Individual Differences in the Alignment of Structural and Functional Markers of the V5/MT Complex in Primates","Large I, Bridge H, Ahmed B, Clare S, Kolasinski J, Lam WW, Miller KL, Dyrby TB, Parker AJ, Smith JET, Daubney G, Sallet J, Bell AH, Krug K.","Cereb Cortex. 2016 Oct;26(10):3928-3944. doi: 10.1093/cercor/bhw180. Epub 2016 Jul 1.","Large I","Cereb Cortex","2016","2016/07/03","PMC5028002","","10.1093/cercor/bhw180"
"27063864","Decreased functional connectivity in dorsolateral prefrontal cortical networks in adult macaques with neonatal hippocampal lesions: Relations to visual working memory deficits","Meng Y, Hu X, Bachevalier J, Zhang X.","Neurobiol Learn Mem. 2016 Oct;134 Pt A(Pt A):31-37. doi: 10.1016/j.nlm.2016.04.003. Epub 2016 Apr 7.","Meng Y","Neurobiol Learn Mem","2016","2016/04/12","PMC6329462","NIHMS1001069","10.1016/j.nlm.2016.04.003"
"26170314","Functional evolution of new and expanded attention networks in humans","Patel GH, Yang D, Jamerson EC, Snyder LH, Corbetta M, Ferrera VP.","Proc Natl Acad Sci U S A. 2015 Jul 28;112(30):9454-9. doi: 10.1073/pnas.1420395112. Epub 2015 Jul 13.","Patel GH","Proc Natl Acad Sci U S A","2015","2015/07/15","PMC4522817","","10.1073/pnas.1420395112"
"26149609","Functional MRI of visual responses in the awake, behaving marmoset","Hung CC, Yen CC, Ciuchta JL, Papoti D, Bock NA, Leopold DA, Silva AC.","Neuroimage. 2015 Oct 15;120:1-11. doi: 10.1016/j.neuroimage.2015.06.090. Epub 2015 Jul 3.","Hung CC","Neuroimage","2015","2015/07/08","PMC4589494","NIHMS711899","10.1016/j.neuroimage.2015.06.090"
"26066653","The Travelling-Wave Primate System: A New Solution for Magnetic Resonance Imaging of Macaque Monkeys at 7 Tesla Ultra-High Field","Herrmann T, Mallow J, Plaumann M, Luchtmann M, Stadler J, Mylius J, Brosch M, Bernarding J.","PLoS One. 2015 Jun 11;10(6):e0129371. doi: 10.1371/journal.pone.0129371. eCollection 2015.","Herrmann T","PLoS One","2015","2015/06/13","PMC4466239","","10.1371/journal.pone.0129371"
"25855174","Network structure shapes spontaneous functional connectivity dynamics","Shen K, Hutchison RM, Bezgin G, Everling S, McIntosh AR.","J Neurosci. 2015 Apr 8;35(14):5579-88. doi: 10.1523/JNEUROSCI.4903-14.2015.","Shen K","J Neurosci","2015","2015/04/10","PMC6605321","","10.1523/JNEUROSCI.4903-14.2015"
"25579448","Functional MRI mapping of dynamic visual features during natural viewing in the macaque","Russ BE, Leopold DA.","Neuroimage. 2015 Apr 1;109:84-94. doi: 10.1016/j.neuroimage.2015.01.012. Epub 2015 Jan 9.","Russ BE","Neuroimage","2015","2015/01/13","PMC4339453","NIHMS657362","10.1016/j.neuroimage.2015.01.012"
"25535356","Natural asynchronies in audiovisual communication signals regulate neuronal multisensory interactions in voice-sensitive cortex","Perrodin C, Kayser C, Logothetis NK, Petkov CI.","Proc Natl Acad Sci U S A. 2015 Jan 6;112(1):273-8. doi: 10.1073/pnas.1412817112. Epub 2014 Dec 22.","Perrodin C","Proc Natl Acad Sci U S A","2015","2014/12/24","PMC4291635","","10.1073/pnas.1412817112"
"25520434","The effect of face inversion for neurons inside and outside fMRI-defined face-selective cortical regions","Taubert J, Van Belle G, Vanduffel W, Rossion B, Vogels R.","J Neurophysiol. 2015 Mar 1;113(5):1644-55. doi: 10.1152/jn.00700.2014. Epub 2014 Dec 17.","Taubert J","J Neurophysiol","2015","2014/12/19","PMC4346728","","10.1152/jn.00700.2014"
"25180883","A neural circuit covarying with social hierarchy in macaques","Noonan MP, Sallet J, Mars RB, Neubert FX, O'Reilly JX, Andersson JL, Mitchell AS, Bell AH, Miller KL, Rushworth MF.","PLoS Biol. 2014 Sep 2;12(9):e1001940. doi: 10.1371/journal.pbio.1001940. eCollection 2014 Sep.","Noonan MP","PLoS Biol","2014","2014/09/03","PMC4151964","","10.1371/journal.pbio.1001940"
"25044934","Isoflurane induces dose-dependent alterations in the cortical connectivity profiles and dynamic properties of the brain's functional architecture","Hutchison RM, Hutchison M, Manning KY, Menon RS, Everling S.","Hum Brain Mapp. 2014 Dec;35(12):5754-75. doi: 10.1002/hbm.22583. Epub 2014 Jul 12.","Hutchison RM","Hum Brain Mapp","2014","2014/07/22","PMC6869297","","10.1002/hbm.22583"
"24244892","Quantitative MRI Measures in SIV-Infected Macaque Brains","Zhang X, Li C.","J Clin Cell Immunol. 2013;Suppl 7:005. doi: 10.4172/2155-9899.S7-005.","Zhang X","J Clin Cell Immunol","2013","2013/11/19","PMC3826881","NIHMS452246","10.4172/2155-9899.S7-005"
"23884933","The organization of dorsal frontal cortex in humans and macaques","Sallet J, Mars RB, Noonan MP, Neubert FX, Jbabdi S, O'Reilly JX, Filippini N, Thomas AG, Rushworth MF.","J Neurosci. 2013 Jul 24;33(30):12255-74. doi: 10.1523/JNEUROSCI.5108-12.2013.","Sallet J","J Neurosci","2013","2013/07/26","PMC3744647","","10.1523/JNEUROSCI.5108-12.2013"
"23773004","A method for conducting functional MRI studies in alert nonhuman primates: initial results with opioid agonists in male cynomolgus monkeys","Kaufman MJ, Janes AC, Frederick Bd, Brimson-Théberge M, Tong Y, McWilliams SB, Bear A, Gillis TE, Schrode KM, Renshaw PF, Negus SS.","Exp Clin Psychopharmacol. 2013 Aug;21(4):323-31. doi: 10.1037/a0033062. Epub 2013 Jun 17.","Kaufman MJ","Exp Clin Psychopharmacol","2013","2013/06/19","PMC3916219","NIHMS546580","10.1037/a0033062"
"22592304","Adaptation to heading direction dissociates the roles of human MST and V6 in the processing of optic flow","Cardin V, Hemsworth L, Smith AT.","J Neurophysiol. 2012 Aug 1;108(3):794-801. doi: 10.1152/jn.00002.2012. Epub 2012 May 16.","Cardin V","J Neurophysiol","2012","2012/05/18","PMC3424094","","10.1152/jn.00002.2012"
"22438275","Resting-state networks show dynamic functional connectivity in awake humans and anesthetized macaques","Hutchison RM, Womelsdorf T, Gati JS, Everling S, Menon RS.","Hum Brain Mapp. 2013 Sep;34(9):2154-77. doi: 10.1002/hbm.22058. Epub 2012 Mar 22.","Hutchison RM","Hum Brain Mapp","2013","2012/03/23","PMC6870538","","10.1002/hbm.22058"
"22325210","Behavioral and anatomical consequences of early versus late symbol training in macaques","Srihasam K, Mandeville JB, Morocz IA, Sullivan KJ, Livingstone MS.","Neuron. 2012 Feb 9;73(3):608-19. doi: 10.1016/j.neuron.2011.12.022.","Srihasam K","Neuron","2012","2012/02/14","PMC3278713","NIHMS350210","10.1016/j.neuron.2011.12.022"
"21483719","The ""parahippocampal place area"" responds preferentially to high spatial frequencies in humans and monkeys","Rajimehr R, Devaney KJ, Bilenko NY, Young JC, Tootell RB.","PLoS Biol. 2011 Apr;9(4):e1000608. doi: 10.1371/journal.pbio.1000608. Epub 2011 Apr 5.","Rajimehr R","PLoS Biol","2011","2011/04/13","PMC3071373","","10.1371/journal.pbio.1000608"
"21411650","Diffusion-weighted imaging tractography-based parcellation of the human parietal cortex and comparison with human and macaque resting-state functional connectivity","Mars RB, Jbabdi S, Sallet J, O'Reilly JX, Croxson PL, Olivier E, Noonan MP, Bergmann C, Mitchell AS, Baxter MG, Behrens TE, Johansen-Berg H, Tomassini V, Miller KL, Rushworth MF.","J Neurosci. 2011 Mar 16;31(11):4087-100. doi: 10.1523/JNEUROSCI.5102-10.2011.","Mars RB","J Neurosci","2011","2011/03/18","PMC3091022","UKMS34710","10.1523/JNEUROSCI.5102-10.2011"
"20538772","Surface-based information mapping reveals crossmodal vision-action representations in human parietal and occipitotemporal cortex","Oosterhof NN, Wiggett AJ, Diedrichsen J, Tipper SP, Downing PE.","J Neurophysiol. 2010 Aug;104(2):1077-89. doi: 10.1152/jn.00326.2010. Epub 2010 Jun 10.","Oosterhof NN","J Neurophysiol","2010","2010/06/12","PMC2934920","","10.1152/jn.00326.2010"
"20173093","Topographic organization of macaque area LIP","Patel GH, Shulman GL, Baker JT, Akbudak E, Snyder AZ, Snyder LH, Corbetta M.","Proc Natl Acad Sci U S A. 2010 Mar 9;107(10):4728-33. doi: 10.1073/pnas.0908092107. Epub 2010 Feb 19.","Patel GH","Proc Natl Acad Sci U S A","2010","2010/02/23","PMC2842044","","10.1073/pnas.0908092107"
"18416684","Feedforward and recurrent processing in scene segmentation: electroencephalography and functional magnetic resonance imaging","Scholte HS, Jolij J, Fahrenfort JJ, Lamme VA.","J Cogn Neurosci. 2008 Nov;20(11):2097-109. doi: 10.1162/jocn.2008.20142.","Scholte HS","J Cogn Neurosci","2008","2008/04/18","","","10.1162/jocn.2008.20142"
"18375769","Perception of emotional expressions is independent of face selectivity in monkey inferior temporal cortex","Hadj-Bouziane F, Bell AH, Knusten TA, Ungerleider LG, Tootell RB.","Proc Natl Acad Sci U S A. 2008 Apr 8;105(14):5591-6. doi: 10.1073/pnas.0800489105. Epub 2008 Mar 28.","Hadj-Bouziane F","Proc Natl Acad Sci U S A","2008","2008/04/01","PMC2291084","","10.1073/pnas.0800489105"
"17896395","MRI of spontaneous fluctuations after acute cerebral ischemia in nonhuman primates","Liu Y, D'Arceuil H, He J, Duggan M, Gonzalez G, Pryor J, de Crespigny A.","J Magn Reson Imaging. 2007 Oct;26(4):1112-6. doi: 10.1002/jmri.21131.","Liu Y","J Magn Reson Imaging","2007","2007/09/27","","","10.1002/jmri.21131"
"14754864","The parahippocampal gyrus in the baboon: anatomical, cytoarchitectonic and magnetic resonance imaging (MRI) studies","Blaizot X, Martinez-Marcos A, Arroyo-Jimenez Md Mdel M, Marcos P, Artacho-Pérula E, Muñoz M, Chavoix C, Insausti R.","Cereb Cortex. 2004 Mar;14(3):231-46. doi: 10.1093/cercor/bhg123.","Blaizot X","Cereb Cortex","2004","2004/02/03","","","10.1093/cercor/bhg123"
"12843312","Representation of umami taste in the human brain","de Araujo IE, Kringelbach ML, Rolls ET, Hobden P.","J Neurophysiol. 2003 Jul;90(1):313-9. doi: 10.1152/jn.00669.2002.","de Araujo IE","J Neurophysiol","2003","2003/07/05","","","10.1152/jn.00669.2002"
