PMID,Title,Authors,Citation,First Author,Journal/Book,Publication Year,Create Date,PMCID,NIHMS ID,DOI
"31039559","Brain Connectivity in Ateles geoffroyi: Resting-State Functional Magnetic Resonance Imaging of Working Memory and Executive Control","Platas-Neri D, Hidalgo-Tobón S, Chico-Ponce de León F, Muñoz-Delgado J, Phillips KA, Téllez-Alanís B, Villanueva-Valle J, de Celis Alonso B.","Brain Behav Evol. 2019;93(1):19-33. doi: 10.1159/000499177. Epub 2019 Apr 30.","Platas-Neri D","Brain Behav Evol","2019","2019/05/01","","","10.1159/000499177"
"30879997","Integrated radiofrequency array and animal holder design for minimizing head motion during awake marmoset functional magnetic resonance imaging","Schaeffer DJ, Gilbert KM, Hori Y, Gati JS, Menon RS, Everling S.","Neuroimage. 2019 Jun;193:126-138. doi: 10.1016/j.neuroimage.2019.03.023. Epub 2019 Mar 15.","Schaeffer DJ","Neuroimage","2019","2019/03/19","","","10.1016/j.neuroimage.2019.03.023"
"32981657","Converging Structural and Functional Evidence for a Rat Salience Network","Tsai PJ, Keeley RJ, Carmack SA, Vendruscolo JCM, Lu H, Gu H, Vendruscolo LF, Koob GF, Lin CP, Stein EA, Yang Y.","Biol Psychiatry. 2020 Dec 1;88(11):867-878. doi: 10.1016/j.biopsych.2020.06.023. Epub 2020 Jul 2.","Tsai PJ","Biol Psychiatry","2020","2020/09/28","","","10.1016/j.biopsych.2020.06.023"
"28755862","Ketamine changes the local resting-state functional properties of anesthetized-monkey brain","Rao JS, Liu Z, Zhao C, Wei RH, Zhao W, Tian PY, Zhou X, Yang ZY, Li XG.","Magn Reson Imaging. 2017 Nov;43:144-150. doi: 10.1016/j.mri.2017.07.025. Epub 2017 Jul 26.","Rao JS","Magn Reson Imaging","2017","2017/07/31","","","10.1016/j.mri.2017.07.025"
"26290449","Resting-state functional connectivity in the baboon model of genetic generalized epilepsy","Salinas FS, Szabó CÁ.","Epilepsia. 2015 Oct;56(10):1580-9. doi: 10.1111/epi.13115. Epub 2015 Aug 20.","Salinas FS","Epilepsia","2015","2015/08/21","PMC4593742","NIHMS708606","10.1111/epi.13115"
"29352154","Resting state brain networks in the prairie vole","Ortiz JJ, Portillo W, Paredes RG, Young LJ, Alcauter S.","Sci Rep. 2018 Jan 19;8(1):1231. doi: 10.1038/s41598-017-17610-9.","Ortiz JJ","Sci Rep","2018","2018/01/21","PMC5775431","","10.1038/s41598-017-17610-9"
"29496614","Segregation of the human basal forebrain using resting state functional MRI","Markello RD, Spreng RN, Luh WM, Anderson AK, De Rosa E.","Neuroimage. 2018 Jun;173:287-297. doi: 10.1016/j.neuroimage.2018.02.042. Epub 2018 Feb 26.","Markello RD","Neuroimage","2018","2018/03/03","","","10.1016/j.neuroimage.2018.02.042"
"28032008","Effects of isoflurane anesthesia on resting-state fMRI signals and functional connectivity within primary somatosensory cortex of monkeys","Wu TL, Mishra A, Wang F, Yang PF, Gore JC, Chen LM.","Brain Behav. 2016 Oct 11;6(12):e00591. doi: 10.1002/brb3.591. eCollection 2016 Dec.","Wu TL","Brain Behav","2016","2016/12/30","PMC5167001","","10.1002/brb3.591"
"31649271","Resting-state fMRI data of awake dogs (Canis familiaris) via group-level independent component analysis reveal multiple, spatially distributed resting-state networks","Szabó D, Czeibert K, Kettinger Á, Gácsi M, Andics A, Miklósi Á, Kubinyi E.","Sci Rep. 2019 Oct 24;9(1):15270. doi: 10.1038/s41598-019-51752-2.","Szabó D","Sci Rep","2019","2019/10/26","PMC6813298","","10.1038/s41598-019-51752-2"
"31219563","From Synchrony to Asynchrony: Cerebellar-Basal Ganglia Functional Circuits in Young and Older Adults","Hausman HK, Jackson TB, Goen JRM, Bernard JA.","Cereb Cortex. 2020 Mar 21;30(2):718-729. doi: 10.1093/cercor/bhz121.","Hausman HK","Cereb Cortex","2020","2019/06/21","","","10.1093/cercor/bhz121"
"27451405","Effects of anesthesia on resting state BOLD signals in white matter of non-human primates","Wu TL, Wang F, Anderson AW, Chen LM, Ding Z, Gore JC.","Magn Reson Imaging. 2016 Nov;34(9):1235-1241. doi: 10.1016/j.mri.2016.07.001. Epub 2016 Jul 20.","Wu TL","Magn Reson Imaging","2016","2016/07/25","PMC5055423","NIHMS804667","10.1016/j.mri.2016.07.001"
"27596024","Resting state network topology of the ferret brain","Zhou ZC, Salzwedel AP, Radtke-Schuller S, Li Y, Sellers KK, Gilmore JH, Shih YY, Fröhlich F, Gao W.","Neuroimage. 2016 Dec;143:70-81. doi: 10.1016/j.neuroimage.2016.09.003. Epub 2016 Sep 2.","Zhou ZC","Neuroimage","2016","2016/09/07","PMC5124532","NIHMS817278","10.1016/j.neuroimage.2016.09.003"
"30873000","Brain Map of Intrinsic Functional Flexibility in Anesthetized Monkeys and Awake Humans","Yin D, Zhang Z, Wang Z, Zeljic K, Lv Q, Cai D, Wang Y, Wang Z.","Front Neurosci. 2019 Feb 28;13:174. doi: 10.3389/fnins.2019.00174. eCollection 2019.","Yin D","Front Neurosci","2019","2019/03/16","PMC6403192","","10.3389/fnins.2019.00174"
"22465841","Evidence for coordinated functional activity within the extended amygdala of non-human and human primates","Oler JA, Birn RM, Patriat R, Fox AS, Shelton SE, Burghy CA, Stodola DE, Essex MJ, Davidson RJ, Kalin NH.","Neuroimage. 2012 Jul 16;61(4):1059-66. doi: 10.1016/j.neuroimage.2012.03.045. Epub 2012 Mar 23.","Oler JA","Neuroimage","2012","2012/04/03","PMC3376204","NIHMS364904","10.1016/j.neuroimage.2012.03.045"
"33427167","Developmental outcomes of early adverse care on amygdala functional connectivity in nonhuman primates","Morin EL, Howell BR, Feczko E, Earl E, Pincus M, Reding K, Kovacs-Balint ZA, Meyer JS, Styner M, Fair D, Sanchez MM.","Dev Psychopathol. 2020 Dec;32(5):1579-1596. doi: 10.1017/S0954579420001133.","Morin EL","Dev Psychopathol","2020","2021/01/11","","","10.1017/S0954579420001133"
"32469053","Dynamic Reconfiguration, Fragmentation, and Integration of Whole-Brain Modular Structure across Depths of Unconsciousness","Standage D, Areshenkoff CN, Nashed JY, Hutchison RM, Hutchison M, Heinke D, Menon RS, Everling S, Gallivan JP.","Cereb Cortex. 2020 Sep 3;30(10):5229-5241. doi: 10.1093/cercor/bhaa085.","Standage D","Cereb Cortex","2020","2020/05/30","PMC7472202","","10.1093/cercor/bhaa085"
"30419289","Intrinsic functional clustering of anterior cingulate cortex in the common marmoset","Schaeffer DJ, Gilbert KM, Ghahremani M, Gati JS, Menon RS, Everling S.","Neuroimage. 2019 Feb 1;186:301-307. doi: 10.1016/j.neuroimage.2018.11.005. Epub 2018 Nov 10.","Schaeffer DJ","Neuroimage","2019","2018/11/13","","","10.1016/j.neuroimage.2018.11.005"
"23919836","Anti-correlated cortical networks of intrinsic connectivity in the rat brain","Schwarz AJ, Gass N, Sartorius A, Risterucci C, Spedding M, Schenker E, Meyer-Lindenberg A, Weber-Fahr W.","Brain Connect. 2013;3(5):503-11. doi: 10.1089/brain.2013.0168. Epub 2013 Sep 26.","Schwarz AJ","Brain Connect","2013","2013/08/08","PMC3796325","","10.1089/brain.2013.0168"
"24164166","Graphs of brain networks","Zahr NM.","Alcohol Clin Exp Res. 2013 Nov;37(11):1813-5. doi: 10.1111/acer.12293.","Zahr NM","Alcohol Clin Exp Res","2013","2013/10/30","PMC8146133","NIHMS1699229","10.1111/acer.12293"
"25833027","The effects of chronic alcohol self-administration in nonhuman primate brain networks","Telesford QK, Laurienti PJ, Davenport AT, Friedman DP, Kraft RA, Daunais JB.","Alcohol Clin Exp Res. 2015 Apr;39(4):659-71. doi: 10.1111/acer.12688.","Telesford QK","Alcohol Clin Exp Res","2015","2015/04/03","PMC6724209","NIHMS659294","10.1111/acer.12688"
"18701759","Intrinsic functional relations between human cerebral cortex and thalamus","Zhang D, Snyder AZ, Fox MD, Sansbury MW, Shimony JS, Raichle ME.","J Neurophysiol. 2008 Oct;100(4):1740-8. doi: 10.1152/jn.90463.2008. Epub 2008 Aug 13.","Zhang D","J Neurophysiol","2008","2008/08/15","PMC2576214","","10.1152/jn.90463.2008"
"24530271","Parkinson׳s disease-related modulation of functional connectivity associated with the striatum in the resting state in a nonhuman primate model","Li J, Luo C, Chen Y, Chen Q, Huang R, Sun J, Gong Q, Wu X, Qi Z, Liang Z, Li L, Li H, Li P, Wang W, Shang HF.","Brain Res. 2014 Mar 25;1555:10-9. doi: 10.1016/j.brainres.2014.01.054. Epub 2014 Feb 13.","Li J","Brain Res","2014","2014/02/18","","","10.1016/j.brainres.2014.01.054"
"31557544","Large scale networks for human hand-object interaction: Functionally distinct roles for two premotor regions identified intraoperatively","Simone L, Fornia L, Viganò L, Sambataro F, Rossi M, Leonetti A, Puglisi G, Howells H, Bellacicca A, Bello L, Cerri G.","Neuroimage. 2020 Jan 1;204:116215. doi: 10.1016/j.neuroimage.2019.116215. Epub 2019 Sep 24.","Simone L","Neuroimage","2020","2019/09/27","","","10.1016/j.neuroimage.2019.116215"
"23899724","The amplitude of the resting-state fMRI global signal is related to EEG vigilance measures","Wong CW, Olafsson V, Tal O, Liu TT.","Neuroimage. 2013 Dec;83:983-90. doi: 10.1016/j.neuroimage.2013.07.057. Epub 2013 Jul 27.","Wong CW","Neuroimage","2013","2013/08/01","PMC3815994","NIHMS511312","10.1016/j.neuroimage.2013.07.057"
"26467643","Essential tremor is associated with disruption of functional connectivity in the ventral intermediate Nucleus--Motor Cortex--Cerebellum circuit","Fang W, Chen H, Wang H, Zhang H, Puneet M, Liu M, Lv F, Luo T, Cheng O, Wang X, Lu X.","Hum Brain Mapp. 2016 Jan;37(1):165-78. doi: 10.1002/hbm.23024. Epub 2015 Oct 15.","Fang W","Hum Brain Mapp","2016","2015/10/16","PMC6867464","","10.1002/hbm.23024"
