PMID,Title,Authors,Citation,First Author,Journal/Book,Publication Year,Create Date,PMCID,NIHMS ID,DOI
"32038217","Animal Functional Magnetic Resonance Imaging: Trends and Path Toward Standardization","Mandino F, Cerri DH, Garin CM, Straathof M, van Tilborg GAF, Chakravarty MM, Dhenain M, Dijkhuizen RM, Gozzi A, Hess A, Keilholz SD, Lerch JP, Shih YI, Grandjean J.","Front Neuroinform. 2020 Jan 22;13:78. doi: 10.3389/fninf.2019.00078. eCollection 2019.","Mandino F","Front Neuroinform","2020","2020/02/11","PMC6987455","","10.3389/fninf.2019.00078"
"22855672","Monkey in the middle: why non-human primates are needed to bridge the gap in resting-state investigations","Hutchison RM, Everling S.","Front Neuroanat. 2012 Jul 26;6:29. doi: 10.3389/fnana.2012.00029. eCollection 2012.","Hutchison RM","Front Neuroanat","2012","2012/08/03","PMC3405297","","10.3389/fnana.2012.00029"
"24121168","The helmet head restraint system: a viable solution for resting state fMRI in awake monkeys","Hadj-Bouziane F, Monfardini E, Guedj C, Gardechaux G, Hynaux C, Farnè A, Meunier M.","Neuroimage. 2014 Feb 1;86:536-43. doi: 10.1016/j.neuroimage.2013.09.068. Epub 2013 Oct 8.","Hadj-Bouziane F","Neuroimage","2014","2013/10/15","","","10.1016/j.neuroimage.2013.09.068"
"33338613","Altered hippocampal-prefrontal functional network integrity in adult macaque monkeys with neonatal hippocampal lesions","Li CX, Li Z, Hu X, Zhang X, Bachevalier J.","Neuroimage. 2021 Feb 15;227:117645. doi: 10.1016/j.neuroimage.2020.117645. Epub 2020 Dec 15.","Li CX","Neuroimage","2021","2020/12/18","","","10.1016/j.neuroimage.2020.117645"
"24629510","Fractional amplitude of low-frequency fluctuation changes in monkeys with spinal cord injury: a resting-state fMRI study","Rao JS, Ma M, Zhao C, Zhang AF, Yang ZY, Liu Z, Li XG.","Magn Reson Imaging. 2014 Jun;32(5):482-6. doi: 10.1016/j.mri.2014.02.001. Epub 2014 Feb 10.","Rao JS","Magn Reson Imaging","2014","2014/03/18","","","10.1016/j.mri.2014.02.001"
"33789138","A comprehensive macaque fMRI pipeline and hierarchical atlas","Jung B, Taylor PA, Seidlitz J, Sponheim C, Perkins P, Ungerleider LG, Glen D, Messinger A.","Neuroimage. 2021 Jul 15;235:117997. doi: 10.1016/j.neuroimage.2021.117997. Epub 2021 Mar 28.","Jung B","Neuroimage","2021","2021/03/31","","","10.1016/j.neuroimage.2021.117997"
"27091582","Correlated inter-regional variations in low frequency local field potentials and resting state BOLD signals within S1 cortex of monkeys","Wilson GH 3rd, Yang PF, Gore JC, Chen LM.","Hum Brain Mapp. 2016 Aug;37(8):2755-66. doi: 10.1002/hbm.23207. Epub 2016 Apr 19.","Wilson GH 3rd","Hum Brain Mapp","2016","2016/04/20","PMC4945372","NIHMS773165","10.1002/hbm.23207"
