PMID,Title,Authors,Citation,First Author,Journal/Book,Publication Year,Create Date,PMCID,NIHMS ID,DOI
"23696219","An embedded four-channel receive-only RF coil array for fMRI experiments of the somatosensory pathway in conscious awake marmosets","Papoti D, Yen CC, Mackel JB, Merkle H, Silva AC.","NMR Biomed. 2013 Nov;26(11):1395-402. doi: 10.1002/nbm.2965. Epub 2013 May 22.","Papoti D","NMR Biomed","2013","2013/05/23","PMC4200535","NIHMS628254","10.1002/nbm.2965"
"23652854","Large-scale reorganization of the somatosensory cortex of adult macaque monkeys revealed by fMRI","Dutta A, Kambi N, Raghunathan P, Khushu S, Jain N.","Brain Struct Funct. 2014 Jul;219(4):1305-20. doi: 10.1007/s00429-013-0569-8. Epub 2013 May 8.","Dutta A","Brain Struct Funct","2014","2013/05/09","","","10.1007/s00429-013-0569-8"
"23577096","Selectivity to translational egomotion in human brain motion areas","Pitzalis S, Sdoia S, Bultrini A, Committeri G, Di Russo F, Fattori P, Galletti C, Galati G.","PLoS One. 2013;8(4):e60241. doi: 10.1371/journal.pone.0060241. Epub 2013 Apr 5.","Pitzalis S","PLoS One","2013","2013/04/12","PMC3618224","","10.1371/journal.pone.0060241"
"23525516","Human Object-Similarity Judgments Reflect and Transcend the Primate-IT Object Representation","Mur M, Meys M, Bodurka J, Goebel R, Bandettini PA, Kriegeskorte N.","Front Psychol. 2013 Mar 22;4:128. doi: 10.3389/fpsyg.2013.00128. eCollection 2013.","Mur M","Front Psychol","2013","2013/03/26","PMC3605517","","10.3389/fpsyg.2013.00128"
"23522051","Dopaminergic reward signals selectively decrease fMRI activity in primate visual cortex","Arsenault JT, Nelissen K, Jarraya B, Vanduffel W.","Neuron. 2013 Mar 20;77(6):1174-86. doi: 10.1016/j.neuron.2013.01.008.","Arsenault JT","Neuron","2013","2013/03/26","PMC3610182","NIHMS450724","10.1016/j.neuron.2013.01.008"
"23518007","fMRI analysis of contrast polarity in face-selective cortex in humans and monkeys","Yue X, Nasr S, Devaney KJ, Holt DJ, Tootell RB.","Neuroimage. 2013 Aug 1;76:57-69. doi: 10.1016/j.neuroimage.2013.02.068. Epub 2013 Mar 19.","Yue X","Neuroimage","2013","2013/03/23","PMC3647014","NIHMS459477","10.1016/j.neuroimage.2013.02.068"
"23142071","Dissimilar processing of emotional facial expressions in human and monkey temporal cortex","Zhu Q, Nelissen K, Van den Stock J, De Winter FL, Pauwels K, de Gelder B, Vanduffel W, Vandenbulcke M.","Neuroimage. 2013 Feb 1;66:402-11. doi: 10.1016/j.neuroimage.2012.10.083. Epub 2012 Nov 8.","Zhu Q","Neuroimage","2013","2012/11/13","PMC3625447","NIHMS424750","10.1016/j.neuroimage.2012.10.083"
"22992489","Data-driven analysis of analogous brain networks in monkeys and humans during natural vision","Mantini D, Corbetta M, Romani GL, Orban GA, Vanduffel W.","Neuroimage. 2012 Nov 15;63(3):1107-18. doi: 10.1016/j.neuroimage.2012.08.042. Epub 2012 Aug 21.","Mantini D","Neuroimage","2012","2012/09/21","PMC3472137","NIHMS402591","10.1016/j.neuroimage.2012.08.042"
"22967832","Deep brain stimulation induces BOLD activation in motor and non-motor networks: an fMRI comparison study of STN and EN/GPi DBS in large animals","Min HK, Hwang SC, Marsh MP, Kim I, Knight E, Striemer B, Felmlee JP, Welker KM, Blaha CD, Chang SY, Bennet KE, Lee KH.","Neuroimage. 2012 Nov 15;63(3):1408-20. doi: 10.1016/j.neuroimage.2012.08.006. Epub 2012 Aug 10.","Min HK","Neuroimage","2012","2012/09/13","PMC3487590","NIHMS408367","10.1016/j.neuroimage.2012.08.006"
"22923360","Detailed functional and structural characterization of a macular lesion in a rhesus macaque","Dominik Fischer M, Zobor D, Keliris GA, Shao Y, Seeliger MW, Haverkamp S, Jägle H, Logothetis NK, Smirnakis SM.","Doc Ophthalmol. 2012 Dec;125(3):179-94. doi: 10.1007/s10633-012-9340-3. Epub 2012 Aug 26.","Dominik Fischer M","Doc Ophthalmol","2012","2012/08/28","PMC7548104","NIHMS1625701","10.1007/s10633-012-9340-3"
"22905823","Visual short-term memory load reduces retinotopic cortex response to contrast","Konstantinou N, Bahrami B, Rees G, Lavie N.","J Cogn Neurosci. 2012 Nov;24(11):2199-210. doi: 10.1162/jocn_a_00279. Epub 2012 Aug 20.","Konstantinou N","J Cogn Neurosci","2012","2012/08/22","","","10.1162/jocn_a_00279"
"22885246","Selective responses to specular surfaces in the macaque visual cortex revealed by fMRI","Okazawa G, Goda N, Komatsu H.","Neuroimage. 2012 Nov 15;63(3):1321-33. doi: 10.1016/j.neuroimage.2012.07.052. Epub 2012 Aug 1.","Okazawa G","Neuroimage","2012","2012/08/14","","","10.1016/j.neuroimage.2012.07.052"
"22855672","Monkey in the middle: why non-human primates are needed to bridge the gap in resting-state investigations","Hutchison RM, Everling S.","Front Neuroanat. 2012 Jul 26;6:29. doi: 10.3389/fnana.2012.00029. eCollection 2012.","Hutchison RM","Front Neuroanat","2012","2012/08/03","PMC3405297","","10.3389/fnana.2012.00029"
"22840516","Optogenetically induced behavioral and functional network changes in primates","Gerits A, Farivar R, Rosen BR, Wald LL, Boyden ES, Vanduffel W.","Curr Biol. 2012 Sep 25;22(18):1722-6. doi: 10.1016/j.cub.2012.07.023. Epub 2012 Jul 26.","Gerits A","Curr Biol","2012","2012/07/31","PMC3461112","NIHMS394358","10.1016/j.cub.2012.07.023"
"22783176","Monitoring extracellular pH, oxygen, and dopamine during reward delivery in the striatum of primates","Ariansen JL, Heien ML, Hermans A, Phillips PE, Hernadi I, Bermudez MA, Schultz W, Wightman RM.","Front Behav Neurosci. 2012 Jul 5;6:36. doi: 10.3389/fnbeh.2012.00036. eCollection 2012.","Ariansen JL","Front Behav Neurosci","2012","2012/07/12","PMC3389715","","10.3389/fnbeh.2012.00036"
"22553030","Connectivity-based parcellation of the human orbitofrontal cortex","Kahnt T, Chang LJ, Park SQ, Heinzle J, Haynes JD.","J Neurosci. 2012 May 2;32(18):6240-50. doi: 10.1523/JNEUROSCI.0257-12.2012.","Kahnt T","J Neurosci","2012","2012/05/04","PMC6622144","","10.1523/JNEUROSCI.0257-12.2012"
"22521477","Hundreds of brain maps in one atlas: registering coordinate-independent primate neuro-anatomical data to a standard brain","Bezgin G, Vakorin VA, van Opstal AJ, McIntosh AR, Bakker R.","Neuroimage. 2012 Aug 1;62(1):67-76. doi: 10.1016/j.neuroimage.2012.04.013. Epub 2012 Apr 14.","Bezgin G","Neuroimage","2012","2012/04/24","","","10.1016/j.neuroimage.2012.04.013"
"22504764","What does polarity inversion of extrastriate activity tell us about striate contributions to the early VEP? A comment on Ales et al. (2010)","Kelly SP, Schroeder CE, Lalor EC.","Neuroimage. 2013 Aug 1;76:442-5. doi: 10.1016/j.neuroimage.2012.03.081. Epub 2012 Apr 5.","Kelly SP","Neuroimage","2013","2012/04/17","","","10.1016/j.neuroimage.2012.03.081"
"22235303","A functional and structural investigation of the human fronto-basal volitional saccade network","Neggers SF, Diepen RM, Zandbelt BB, Vink M, Mandl RC, Gutteling TP.","PLoS One. 2012;7(1):e29517. doi: 10.1371/journal.pone.0029517. Epub 2012 Jan 3.","Neggers SF","PLoS One","2012","2012/01/12","PMC3250458","","10.1371/journal.pone.0029517"
"22219283","Echoes of the brain within the posterior cingulate cortex","Leech R, Braga R, Sharp DJ.","J Neurosci. 2012 Jan 4;32(1):215-22. doi: 10.1523/JNEUROSCI.3689-11.2012.","Leech R","J Neurosci","2012","2012/01/06","PMC6621313","","10.1523/JNEUROSCI.3689-11.2012"
"22178134","Mapping the central effects of chronic ketamine administration in an adolescent primate model by functional magnetic resonance imaging (fMRI)","Yu H, Li Q, Wang D, Shi L, Lu G, Sun L, Wang L, Zhu W, Mak YT, Wong N, Wang Y, Pan F, Yew DT.","Neurotoxicology. 2012 Jan;33(1):70-7. doi: 10.1016/j.neuro.2011.11.001. Epub 2011 Dec 2.","Yu H","Neurotoxicology","2012","2011/12/20","","","10.1016/j.neuro.2011.11.001"
"22158821","Perceptual learning incepted by decoded fMRI neurofeedback without stimulus presentation","Shibata K, Watanabe T, Sasaki Y, Kawato M.","Science. 2011 Dec 9;334(6061):1413-5. doi: 10.1126/science.1212003.","Shibata K","Science","2011","2011/12/14","PMC3297423","NIHMS359501","10.1126/science.1212003"
"22114283","Decoding effector-dependent and effector-independent movement intentions from human parieto-frontal brain activity","Gallivan JP, McLean DA, Smith FW, Culham JC.","J Neurosci. 2011 Nov 23;31(47):17149-68. doi: 10.1523/JNEUROSCI.1058-11.2011.","Gallivan JP","J Neurosci","2011","2011/11/25","PMC6623835","","10.1523/JNEUROSCI.1058-11.2011"
"22081989","Stimulus-induced dissociation of neuronal firing rates and local field potential gamma power and its relationship to the resonance blood oxygen level-dependent signal in macaque primary visual cortex","Bartolo MJ, Gieselmann MA, Vuksanovic V, Hunter D, Sun L, Chen X, Delicato LS, Thiele A.","Eur J Neurosci. 2011 Dec;34(11):1857-70. doi: 10.1111/j.1460-9568.2011.07877.x. Epub 2011 Nov 14.","Bartolo MJ","Eur J Neurosci","2011","2011/11/16","PMC3274700","","10.1111/j.1460-9568.2011.07877.x"
"21843550","Multimodal vessel mapping for precise large area alignment of functional optical imaging data to neuroanatomical preparations in marmosets","Valverde Salzmann MF, Wallace DJ, Logothetis NK, Schüz A.","J Neurosci Methods. 2011 Sep 30;201(1):159-72. doi: 10.1016/j.jneumeth.2011.07.029. Epub 2011 Aug 6.","Valverde Salzmann MF","J Neurosci Methods","2011","2011/08/17","","","10.1016/j.jneumeth.2011.07.029"
"21835625","Voice cells in the primate temporal lobe","Perrodin C, Kayser C, Logothetis NK, Petkov CI.","Curr Biol. 2011 Aug 23;21(16):1408-15. doi: 10.1016/j.cub.2011.07.028. Epub 2011 Aug 11.","Perrodin C","Curr Biol","2011","2011/08/13","PMC3398143","UKMS49151","10.1016/j.cub.2011.07.028"
"21687796","Faces and eyes in human lateral prefrontal cortex","Chan AW, Downing PE.","Front Hum Neurosci. 2011 Jun 2;5:51. doi: 10.3389/fnhum.2011.00051. eCollection 2011.","Chan AW","Front Hum Neurosci","2011","2011/06/21","PMC3108382","","10.3389/fnhum.2011.00051"
"21521619","fMRI of the face-processing network in the ventral temporal lobe of awake and anesthetized macaques","Ku SP, Tolias AS, Logothetis NK, Goense J.","Neuron. 2011 Apr 28;70(2):352-62. doi: 10.1016/j.neuron.2011.02.048.","Ku SP","Neuron","2011","2011/04/28","","","10.1016/j.neuron.2011.02.048"
"21503649","Investigating human audio-visual object perception with a combination of hypothesis-generating and hypothesis-testing fMRI analysis tools","Naumer MJ, van den Bosch JJ, Wibral M, Kohler A, Singer W, Kaiser J, van de Ven V, Muckli L.","Exp Brain Res. 2011 Sep;213(2-3):309-20. doi: 10.1007/s00221-011-2669-0. Epub 2011 Apr 19.","Naumer MJ","Exp Brain Res","2011","2011/04/20","PMC3155044","","10.1007/s00221-011-2669-0"
"21317354","Nonhuman primate positron emission tomography neuroimaging in drug abuse research","Howell LL, Murnane KS.","J Pharmacol Exp Ther. 2011 May;337(2):324-34. doi: 10.1124/jpet.108.136689. Epub 2011 Feb 11.","Howell LL","J Pharmacol Exp Ther","2011","2011/02/15","PMC3083112","","10.1124/jpet.108.136689"
"23382152","Workshop summary: neotropical primates in biomedical research","Tardif SD, Abee CR, Mansfield KG.","ILAR J. 2011;52(3):386-92. doi: 10.1093/ilar.52.3.386.","Tardif SD","ILAR J","2011","2013/02/06","","","10.1093/ilar.52.3.386"
"21177033","High-resolution functional magnetic resonance imaging mapping of noxious heat and tactile activations along the central sulcus in New World monkeys","Chen LM, Dillenburger BC, Wang F, Friedman RM, Avison MJ.","Pain. 2011 Mar;152(3):522-532. doi: 10.1016/j.pain.2010.10.048. Epub 2010 Dec 21.","Chen LM","Pain","2011","2010/12/24","PMC3039029","NIHMS251579","10.1016/j.pain.2010.10.048"
"21170073","Emerging concepts for the dynamical organization of resting-state activity in the brain","Deco G, Jirsa VK, McIntosh AR.","Nat Rev Neurosci. 2011 Jan;12(1):43-56. doi: 10.1038/nrn2961.","Deco G","Nat Rev Neurosci","2011","2010/12/21","","","10.1038/nrn2961"
"21160558","Functional properties of human auditory cortical fields","Woods DL, Herron TJ, Cate AD, Yund EW, Stecker GC, Rinne T, Kang X.","Front Syst Neurosci. 2010 Dec 3;4:155. doi: 10.3389/fnsys.2010.00155. eCollection 2010.","Woods DL","Front Syst Neurosci","2010","2010/12/17","PMC3001989","","10.3389/fnsys.2010.00155"
"21148091","Integration of visual and tactile signals from the hand in the human brain: an FMRI study","Gentile G, Petkova VI, Ehrsson HH.","J Neurophysiol. 2011 Feb;105(2):910-22. doi: 10.1152/jn.00840.2010. Epub 2010 Dec 8.","Gentile G","J Neurophysiol","2011","2010/12/15","PMC3059180","","10.1152/jn.00840.2010"
"20965262","Where sound position influences sound object representations: a 7-T fMRI study","van der Zwaag W, Gentile G, Gruetter R, Spierer L, Clarke S.","Neuroimage. 2011 Feb 1;54(3):1803-11. doi: 10.1016/j.neuroimage.2010.10.032. Epub 2010 Oct 18.","van der Zwaag W","Neuroimage","2011","2010/10/23","","","10.1016/j.neuroimage.2010.10.032"
"20921203","Multisensory space: from eye-movements to self-motion","Bremmer F.","J Physiol. 2011 Feb 15;589(Pt 4):815-23. doi: 10.1113/jphysiol.2010.195537. Epub 2010 Oct 4.","Bremmer F","J Physiol","2011","2010/10/06","PMC3060361","","10.1113/jphysiol.2010.195537"
"20732744","Bilateral activation of the trigeminothalamic tract by acute orofacial cutaneous and muscle pain in humans","Nash PG, Macefield VG, Klineberg IJ, Gustin SM, Murray GM, Henderson LA.","Pain. 2010 Nov;151(2):384-393. doi: 10.1016/j.pain.2010.07.027. Epub 2010 Aug 21.","Nash PG","Pain","2010","2010/08/25","","","10.1016/j.pain.2010.07.027"
"20566353","Development of an apparatus and methodology for conducting functional magnetic resonance imaging (fMRI) with pharmacological stimuli in conscious rhesus monkeys","Murnane KS, Howell LL.","J Neurosci Methods. 2010 Aug 15;191(1):11-20. doi: 10.1016/j.jneumeth.2010.06.001. Epub 2010 Jun 8.","Murnane KS","J Neurosci Methods","2010","2010/06/23","PMC2915932","NIHMS222796","10.1016/j.jneumeth.2010.06.001"
"20493828","MEG in the macaque monkey and human: distinguishing cortical fields in space and time","Zumer JM, Nagarajan SS, Krubitzer LA, Zhu Z, Turner RS, Disbrow EA.","Brain Res. 2010 Jul 23;1345:110-24. doi: 10.1016/j.brainres.2010.05.037. Epub 2010 May 20.","Zumer JM","Brain Res","2010","2010/05/25","PMC2899153","NIHMS213622","10.1016/j.brainres.2010.05.037"
"20171926","The multiple-demand (MD) system of the primate brain: mental programs for intelligent behaviour","Duncan J.","Trends Cogn Sci. 2010 Apr;14(4):172-9. doi: 10.1016/j.tics.2010.01.004. Epub 2010 Feb 18.","Duncan J","Trends Cogn Sci","2010","2010/02/23","","","10.1016/j.tics.2010.01.004"
"20053384","Characterisation of the BOLD response time course at different levels of the auditory pathway in non-human primates","Baumann S, Griffiths TD, Rees A, Hunter D, Sun L, Thiele A.","Neuroimage. 2010 Apr 15;50(3):1099-108. doi: 10.1016/j.neuroimage.2009.12.103. Epub 2010 Jan 4.","Baumann S","Neuroimage","2010","2010/01/08","PMC2880247","","10.1016/j.neuroimage.2009.12.103"
"19961940","Competition between learned reward and error outcome predictions in anterior cingulate cortex","Alexander WH, Brown JW.","Neuroimage. 2010 Feb 15;49(4):3210-8. doi: 10.1016/j.neuroimage.2009.11.065. Epub 2009 Dec 1.","Alexander WH","Neuroimage","2010","2009/12/08","PMC2818639","NIHMS163734","10.1016/j.neuroimage.2009.11.065"
"19778621","The folding fingerprint of visual cortex reveals the timing of human V1 and V2","Ales J, Carney T, Klein SA.","Neuroimage. 2010 Feb 1;49(3):2494-502. doi: 10.1016/j.neuroimage.2009.09.022. Epub 2009 Sep 22.","Ales J","Neuroimage","2010","2009/09/26","PMC2818454","NIHMS158661","10.1016/j.neuroimage.2009.09.022"
"19605642","The foveal confluence in human visual cortex","Schira MM, Tyler CW, Breakspear M, Spehar B.","J Neurosci. 2009 Jul 15;29(28):9050-8. doi: 10.1523/JNEUROSCI.1760-09.2009.","Schira MM","J Neurosci","2009","2009/07/17","PMC6665445","","10.1523/JNEUROSCI.1760-09.2009"
"19598180","BOLD-specific cerebral blood volume and blood flow changes during neuronal activation in humans","Chen JJ, Pike GB.","NMR Biomed. 2009 Dec;22(10):1054-62. doi: 10.1002/nbm.1411.","Chen JJ","NMR Biomed","2009","2009/07/15","","","10.1002/nbm.1411"
"19446348","Functional imaging of the human dopaminergic midbrain","Düzel E, Bunzeck N, Guitart-Masip M, Wittmann B, Schott BH, Tobler PN.","Trends Neurosci. 2009 Jun;32(6):321-8. doi: 10.1016/j.tins.2009.02.005. Epub 2009 May 14.","Düzel E","Trends Neurosci","2009","2009/05/19","","","10.1016/j.tins.2009.02.005"
"19397867","Evidence for long-range feedback in target detection: Detection of semantic targets modulates activity in early visual areas","Hon N, Thompson R, Sigala N, Duncan J.","Neuropsychologia. 2009 Jun;47(7):1721-7. doi: 10.1016/j.neuropsychologia.2009.02.011. Epub 2009 Feb 13.","Hon N","Neuropsychologia","2009","2009/04/29","","","10.1016/j.neuropsychologia.2009.02.011"
"19301992","Auditory spatial and object processing in the human planum temporale: no evidence for selectivity","Smith KR, Hsieh IH, Saberi K, Hickok G.","J Cogn Neurosci. 2010 Apr;22(4):632-9. doi: 10.1162/jocn.2009.21196.","Smith KR","J Cogn Neurosci","2010","2009/03/24","","","10.1162/jocn.2009.21196"
"19269312","Multisensory interactions in primate auditory cortex: fMRI and electrophysiology","Kayser C, Petkov CI, Logothetis NK.","Hear Res. 2009 Dec;258(1-2):80-8. doi: 10.1016/j.heares.2009.02.011. Epub 2009 Mar 6.","Kayser C","Hear Res","2009","2009/03/10","","","10.1016/j.heares.2009.02.011"
"19179278","An anterior temporal face patch in human cortex, predicted by macaque maps","Rajimehr R, Young JC, Tootell RB.","Proc Natl Acad Sci U S A. 2009 Feb 10;106(6):1995-2000. doi: 10.1073/pnas.0807304106. Epub 2009 Jan 28.","Rajimehr R","Proc Natl Acad Sci U S A","2009","2009/01/31","PMC2632713","","10.1073/pnas.0807304106"
"19167419","Orientation-specific contextual modulation of the fMRI BOLD response to luminance and chromatic gratings in human visual cortex","McDonald JS, Seymour KJ, Schira MM, Spehar B, Clifford CW.","Vision Res. 2009 May;49(11):1397-405. doi: 10.1016/j.visres.2008.12.014. Epub 2009 Jan 22.","McDonald JS","Vision Res","2009","2009/01/27","","","10.1016/j.visres.2008.12.014"
"19164537","Congenitally altered motor experience alters somatotopic organization of human primary motor cortex","Stoeckel MC, Seitz RJ, Buetefisch CM.","Proc Natl Acad Sci U S A. 2009 Feb 17;106(7):2395-400. doi: 10.1073/pnas.0803733106. Epub 2009 Jan 21.","Stoeckel MC","Proc Natl Acad Sci U S A","2009","2009/01/24","PMC2650167","","10.1073/pnas.0803733106"
"19146347","Spatial frequency tuning in human retinotopic visual areas","Henriksson L, Nurminen L, Hyvärinen A, Vanni S.","J Vis. 2008 Aug 1;8(10):5.1-13. doi: 10.1167/8.10.5.","Henriksson L","J Vis","2008","2009/01/17","","","10.1167/8.10.5"
"19138749","BOLD fMRI activation for anti-saccades in nonhuman primates","Ford KA, Gati JS, Menon RS, Everling S.","Neuroimage. 2009 Apr 1;45(2):470-6. doi: 10.1016/j.neuroimage.2008.12.009. Epub 2008 Dec 24.","Ford KA","Neuroimage","2009","2009/01/14","","","10.1016/j.neuroimage.2008.12.009"
"19079541","Connectivity of the primate superior colliculus mapped by concurrent microstimulation and event-related FMRI","Field CB, Johnston K, Gati JS, Menon RS, Everling S.","PLoS One. 2008;3(12):e3928. doi: 10.1371/journal.pone.0003928. Epub 2008 Dec 11.","Field CB","PLoS One","2008","2008/12/17","PMC2592545","","10.1371/journal.pone.0003928"
"18761038","An open-source hardware and software system for acquisition and real-time processing of electrophysiology during high field MRI","Purdon PL, Millan H, Fuller PL, Bonmassar G.","J Neurosci Methods. 2008 Nov 15;175(2):165-86. doi: 10.1016/j.jneumeth.2008.07.017. Epub 2008 Aug 5.","Purdon PL","J Neurosci Methods","2008","2008/09/02","PMC2855223","NIHMS77940","10.1016/j.jneumeth.2008.07.017"
"18497359","Shape selectivity in primate frontal eye field","Peng X, Sereno ME, Silva AK, Lehky SR, Sereno AB.","J Neurophysiol. 2008 Aug;100(2):796-814. doi: 10.1152/jn.01188.2007. Epub 2008 May 21.","Peng X","J Neurophysiol","2008","2008/05/24","PMC2525712","","10.1152/jn.01188.2007"
"18400791","Activity in face-responsive brain regions is modulated by invisible, attended faces: evidence from masked priming","Kouider S, Eger E, Dolan R, Henson RN.","Cereb Cortex. 2009 Jan;19(1):13-23. doi: 10.1093/cercor/bhn048. Epub 2008 Apr 9.","Kouider S","Cereb Cortex","2009","2008/04/11","PMC2638745","","10.1093/cercor/bhn048"
"18381768","Quantitative multifocal fMRI shows active suppression in human V1","Pihlaja M, Henriksson L, James AC, Vanni S.","Hum Brain Mapp. 2008 Sep;29(9):1001-14. doi: 10.1002/hbm.20442.","Pihlaja M","Hum Brain Mapp","2008","2008/04/03","PMC6870839","","10.1002/hbm.20442"
"18326521","The influence of moderate hypercapnia on neural activity in the anesthetized nonhuman primate","Zappe AC, Uludağ K, Oeltermann A, Uğurbil K, Logothetis NK.","Cereb Cortex. 2008 Nov;18(11):2666-73. doi: 10.1093/cercor/bhn023. Epub 2008 Mar 6.","Zappe AC","Cereb Cortex","2008","2008/03/11","PMC2567427","","10.1093/cercor/bhn023"
"18217810","Topographical representation of binocular depth in the human visual cortex using fMRI","Bridge H, Parker AJ.","J Vis. 2007 Dec 17;7(14):15.1-14. doi: 10.1167/7.14.15.","Bridge H","J Vis","2007","2008/01/26","","","10.1167/7.14.15"
"18024083","fMRI of the temporal lobe of the awake monkey at 7 T","Goense JB, Ku SP, Merkle H, Tolias AS, Logothetis NK.","Neuroimage. 2008 Feb 1;39(3):1081-93. doi: 10.1016/j.neuroimage.2007.09.038. Epub 2007 Sep 29.","Goense JB","Neuroimage","2008","2007/11/21","","","10.1016/j.neuroimage.2007.09.038"
"17889562","Subregions of the ventral striatum show preferential coding of reward magnitude and probability","Yacubian J, Sommer T, Schroeder K, Gläscher J, Braus DF, Büchel C.","Neuroimage. 2007 Nov 15;38(3):557-63. doi: 10.1016/j.neuroimage.2007.08.007. Epub 2007 Aug 22.","Yacubian J","Neuroimage","2007","2007/09/25","","","10.1016/j.neuroimage.2007.08.007"
"17869540","Stereomotion processing in the human occipital cortex","Likova LT, Tyler CW.","Neuroimage. 2007 Nov 1;38(2):293-305. doi: 10.1016/j.neuroimage.2007.06.039. Epub 2007 Jul 28.","Likova LT","Neuroimage","2007","2007/09/18","","","10.1016/j.neuroimage.2007.06.039"
"17597168","Changes in cortical activity after training of working memory--a single-subject analysis","Westerberg H, Klingberg T.","Physiol Behav. 2007 Sep 10;92(1-2):186-92. doi: 10.1016/j.physbeh.2007.05.041. Epub 2007 May 21.","Westerberg H","Physiol Behav","2007","2007/06/29","","","10.1016/j.physbeh.2007.05.041"
"17497631","Localization of human intraparietal areas AIP, CIP, and LIP using surface orientation and saccadic eye movement tasks","Shikata E, McNamara A, Sprenger A, Hamzei F, Glauche V, Büchel C, Binkofski F.","Hum Brain Mapp. 2008 Apr;29(4):411-21. doi: 10.1002/hbm.20396.","Shikata E","Hum Brain Mapp","2008","2007/05/15","PMC6870972","","10.1002/hbm.20396"
"17395577","Morphology, language and the brain: the decompositional substrate for language comprehension","Marslen-Wilson WD, Tyler LK.","Philos Trans R Soc Lond B Biol Sci. 2007 May 29;362(1481):823-36. doi: 10.1098/rstb.2007.2091.","Marslen-Wilson WD","Philos Trans R Soc Lond B Biol Sci","2007","2007/03/31","PMC2430000","","10.1098/rstb.2007.2091"
"17360817","Two-dimensional mapping of the central and parafoveal visual field to human visual cortex","Schira MM, Wade AR, Tyler CW.","J Neurophysiol. 2007 Jun;97(6):4284-95. doi: 10.1152/jn.00972.2006. Epub 2007 Mar 14.","Schira MM","J Neurophysiol","2007","2007/03/16","","","10.1152/jn.00972.2006"
"17355399","Brain basis of early parent-infant interactions: psychology, physiology, and in vivo functional neuroimaging studies","Swain JE, Lorberbaum JP, Kose S, Strathearn L.","J Child Psychol Psychiatry. 2007 Mar-Apr;48(3-4):262-87. doi: 10.1111/j.1469-7610.2007.01731.x.","Swain JE","J Child Psychol Psychiatry","2007","2007/03/16","PMC4318551","NIHMS659890","10.1111/j.1469-7610.2007.01731.x"
"17321759","Time-dependent effects of hyperoxia on the BOLD fMRI signal in primate visual cortex and LGN","Wibral M, Muckli L, Melnikovic K, Scheller B, Alink A, Singer W, Munk MH.","Neuroimage. 2007 Apr 15;35(3):1044-63. doi: 10.1016/j.neuroimage.2006.12.039. Epub 2007 Jan 19.","Wibral M","Neuroimage","2007","2007/02/27","","","10.1016/j.neuroimage.2006.12.039"
"17208181","Separate coding of different gaze directions in the superior temporal sulcus and inferior parietal lobule","Calder AJ, Beaver JD, Winston JS, Dolan RJ, Jenkins R, Eger E, Henson RN.","Curr Biol. 2007 Jan 9;17(1):20-5. doi: 10.1016/j.cub.2006.10.052.","Calder AJ","Curr Biol","2007","2007/01/09","PMC1885952","","10.1016/j.cub.2006.10.052"
"17151220","Neural correlates of disparity-defined shape discrimination in the human brain","Chandrasekaran C, Canon V, Dahmen JC, Kourtzi Z, Welchman AE.","J Neurophysiol. 2007 Feb;97(2):1553-65. doi: 10.1152/jn.01074.2006. Epub 2006 Dec 6.","Chandrasekaran C","J Neurophysiol","2007","2006/12/08","","","10.1152/jn.01074.2006"
"17126063","Retinotopic organization of primary visual cortex in glaucoma: Comparing fMRI measurements of cortical function with visual field loss","Duncan RO, Sample PA, Weinreb RN, Bowd C, Zangwill LM.","Prog Retin Eye Res. 2007 Jan;26(1):38-56. doi: 10.1016/j.preteyeres.2006.10.001. Epub 2006 Nov 27.","Duncan RO","Prog Retin Eye Res","2007","2006/11/28","PMC1940234","NIHMS16265","10.1016/j.preteyeres.2006.10.001"
"17105934","Neural effects of MDMA as determined by functional magnetic resonance imaging and magnetic resonance spectroscopy in awake marmoset monkeys","Meyer JS, Brevard ME, Piper BJ, Ali SF, Ferris CF.","Ann N Y Acad Sci. 2006 Aug;1074:365-76. doi: 10.1196/annals.1369.036.","Meyer JS","Ann N Y Acad Sci","2006","2006/11/16","","","10.1196/annals.1369.036"
