PMID,Title,Authors,Citation,First Author,Journal/Book,Publication Year,Create Date,PMCID,NIHMS ID,DOI
"10372081","Cortical areas activated by bilateral galvanic vestibular stimulation","Lobel E, Kleine JF, Leroy-Willig A, Van de Moortele PF, Le Bihan D, Grüsser OJ, Berthoz A.","Ann N Y Acad Sci. 1999 May 28;871:313-23. doi: 10.1111/j.1749-6632.1999.tb09194.x.","Lobel E","Ann N Y Acad Sci","1999","1999/06/18","","","10.1111/j.1749-6632.1999.tb09194.x"
"9989433","A fronto-parietal system for computing the egocentric spatial frame of reference in humans","Vallar G, Lobel E, Galati G, Berthoz A, Pizzamiglio L, Le Bihan D.","Exp Brain Res. 1999 Feb;124(3):281-6. doi: 10.1007/s002210050624.","Vallar G","Exp Brain Res","1999","1999/02/16","","","10.1007/s002210050624"
"9819274","Functional MRI of galvanic vestibular stimulation","Lobel E, Kleine JF, Bihan DL, Leroy-Willig A, Berthoz A.","J Neurophysiol. 1998 Nov;80(5):2699-709. doi: 10.1152/jn.1998.80.5.2699.","Lobel E","J Neurophysiol","1998","1998/11/18","","","10.1152/jn.1998.80.5.2699"
"9736764","Task-dependent influences of attention on the activation of human primary visual cortex","Watanabe T, Harner AM, Miyauchi S, Sasaki Y, Nielsen M, Palomo D, Mukai I.","Proc Natl Acad Sci U S A. 1998 Sep 15;95(19):11489-92. doi: 10.1073/pnas.95.19.11489.","Watanabe T","Proc Natl Acad Sci U S A","1998","1998/09/16","PMC21670","","10.1073/pnas.95.19.11489"
"9694202","Functional magnetic resonance imaging in macaque cortex","Dubowitz DJ, Chen DY, Atkinson DJ, Grieve KL, Gillikin B, Bradley WG Jr, Andersen RA.","Neuroreport. 1998 Jul 13;9(10):2213-8. doi: 10.1097/00001756-199807130-00012.","Dubowitz DJ","Neuroreport","1998","1998/08/07","","","10.1097/00001756-199807130-00012"
"9655492","fMRI of monkey visual cortex","Stefanacci L, Reber P, Costanza J, Wong E, Buxton R, Zola S, Squire L, Albright T.","Neuron. 1998 Jun;20(6):1051-7. doi: 10.1016/s0896-6273(00)80485-7.","Stefanacci L","Neuron","1998","1998/07/09","","","10.1016/s0896-6273(00)80485-7"
"9559925","Selective activation of human cortical area V5A by a rotating visual stimulus in fMRI; implication of attentional mechanisms","Haug BA, Baudewig J, Paulus W.","Neuroreport. 1998 Mar 9;9(4):611-4. doi: 10.1097/00001756-199803090-00009.","Haug BA","Neuroreport","1998","1998/04/29","","","10.1097/00001756-199803090-00009"
"9521322","Sniffing and smelling: separate subsystems in the human olfactory cortex","Sobel N, Prabhakaran V, Desmond JE, Glover GH, Goode RL, Sullivan EV, Gabrieli JD.","Nature. 1998 Mar 19;392(6673):282-6. doi: 10.1038/32654.","Sobel N","Nature","1998","1998/04/01","","","10.1038/32654"
"9510384","Dorsal cortical regions subserving visually guided saccades in humans: an fMRI study","Luna B, Thulborn KR, Strojwas MH, McCurtain BJ, Berman RA, Genovese CR, Sweeney JA.","Cereb Cortex. 1998 Jan-Feb;8(1):40-7. doi: 10.1093/cercor/8.1.40.","Luna B","Cereb Cortex","1998","1998/03/24","","","10.1093/cercor/8.1.40"
"9478894","An area specialized for spatial working memory in human frontal cortex","Courtney SM, Petit L, Maisog JM, Ungerleider LG, Haxby JV.","Science. 1998 Feb 27;279(5355):1347-51. doi: 10.1126/science.279.5355.1347.","Courtney SM","Science","1998","1998/03/21","","","10.1126/science.279.5355.1347"
"9212283","Dissociation of saccade-related and pursuit-related activation in human frontal eye fields as revealed by fMRI","Petit L, Clark VP, Ingeholm J, Haxby JV.","J Neurophysiol. 1997 Jun;77(6):3386-90. doi: 10.1152/jn.1997.77.6.3386.","Petit L","J Neurophysiol","1997","1997/06/01","","","10.1152/jn.1997.77.6.3386"
"9442842","Processing of complex sounds in the auditory cortex of cat, monkey, and man","Rauschecker JP.","Acta Otolaryngol Suppl. 1997;532:34-8. doi: 10.3109/00016489709126142.","Rauschecker JP","Acta Otolaryngol Suppl","1997","1997/01/01","","","10.3109/00016489709126142"
"8922339","The parahippocampus subserves topographical learning in man","Aguirre GK, Detre JA, Alsop DC, D'Esposito M.","Cereb Cortex. 1996 Nov-Dec;6(6):823-9. doi: 10.1093/cercor/6.6.823.","Aguirre GK","Cereb Cortex","1996","1996/11/01","","","10.1093/cercor/6.6.823"
"8637882","Mapping striate and extrastriate visual areas in human cerebral cortex","DeYoe EA, Carman GJ, Bandettini P, Glickman S, Wieser J, Cox R, Miller D, Neitz J.","Proc Natl Acad Sci U S A. 1996 Mar 19;93(6):2382-6. doi: 10.1073/pnas.93.6.2382.","DeYoe EA","Proc Natl Acad Sci U S A","1996","1996/03/19","PMC39805","","10.1073/pnas.93.6.2382"
