PMID,Title,Authors,Citation,First Author,Journal/Book,Publication Year,Create Date,PMCID,NIHMS ID,DOI
"34215969","Topography of Visual Features in the Human Ventral Visual Pathway","Fan S, Wang X, Wang X, Wei T, Bi Y.","Neurosci Bull. 2021 Jul 2. doi: 10.1007/s12264-021-00734-4. Online ahead of print.","Fan S","Neurosci Bull","2021","2021/07/03","","","10.1007/s12264-021-00734-4"
"33945242","A thermal nociceptive patch in S2 cortex of nonhuman primates: a combined fMRI and electrophysiology study","Ye X, Yang PF, Liu Q, Dillenburger BD, Friedman RM, Chen LM.","Pain. 2021 Feb 23. doi: 10.1097/j.pain.0000000000002247. Online ahead of print.","Ye X","Pain","2021","2021/05/04","","","10.1097/j.pain.0000000000002247"
"33839768","The Brain Circuits and Dynamics of Curiosity-Driven Behavior in Naturally Curious Marmosets","Tian X, Silva AC, Liu C.","Cereb Cortex. 2021 Jul 29;31(9):4220-4232. doi: 10.1093/cercor/bhab080.","Tian X","Cereb Cortex","2021","2021/04/11","","","10.1093/cercor/bhab080"
"33770531","GABA levels in ventral visual cortex decline with age and are associated with neural distinctiveness","Chamberlain JD, Gagnon H, Lalwani P, Cassady KE, Simmonite M, Seidler RD, Taylor SF, Weissman DH, Park DC, Polk TA.","Neurobiol Aging. 2021 Jun;102:170-177. doi: 10.1016/j.neurobiolaging.2021.02.013. Epub 2021 Feb 26.","Chamberlain JD","Neurobiol Aging","2021","2021/03/26","PMC8205971","NIHMS1686882","10.1016/j.neurobiolaging.2021.02.013"
"33745141","The mouth matters most: A functional magnetic resonance imaging study of how dogs perceive inanimate objects","Prichard A, Chhibber R, Athanassiades K, Chiu V, Spivak M, Berns GS.","J Comp Neurol. 2021 Aug 1;529(11):2987-2994. doi: 10.1002/cne.25142. Epub 2021 Mar 25.","Prichard A","J Comp Neurol","2021","2021/03/21","","","10.1002/cne.25142"
"33484849","The nonhuman primate neuroimaging and neuroanatomy project","Hayashi T, Hou Y, Glasser MF, Autio JA, Knoblauch K, Inoue-Murayama M, Coalson T, Yacoub E, Smith S, Kennedy H, Van Essen DC.","Neuroimage. 2021 Apr 1;229:117726. doi: 10.1016/j.neuroimage.2021.117726. Epub 2021 Jan 20.","Hayashi T","Neuroimage","2021","2021/01/23","PMC8079967","NIHMS1688396","10.1016/j.neuroimage.2021.117726"
"33268770","Effects of long-term cocaine self-administration on brain resting-state functional connectivity in nonhuman primates","Kohut SJ, Mintzopoulos D, Kangas BD, Shields H, Brown K, Gillis TE, Rohan ML, Bergman J, Kaufman MJ.","Transl Psychiatry. 2020 Dec 2;10(1):420. doi: 10.1038/s41398-020-01101-z.","Kohut SJ","Transl Psychiatry","2020","2020/12/03","PMC7710734","","10.1038/s41398-020-01101-z"
"33240053","Segregated Co-activation Patterns in the Emergence of Decision Confidence During Visual Perception","Jaeger C, Glim S, Dimulescu C, Ries A, Sorg C, Wohlschläger A.","Front Syst Neurosci. 2020 Nov 10;14:557693. doi: 10.3389/fnsys.2020.557693. eCollection 2020.","Jaeger C","Front Syst Neurosci","2020","2020/11/26","PMC7683611","","10.3389/fnsys.2020.557693"
"33137475","The macaque brain ONPRC18 template with combined gray and white matter labelmap for multimodal neuroimaging studies of Nonhuman Primates","Weiss AR, Liu Z, Wang X, Liguore WA, Kroenke CD, McBride JL.","Neuroimage. 2021 Jan 15;225:117517. doi: 10.1016/j.neuroimage.2020.117517. Epub 2020 Nov 1.","Weiss AR","Neuroimage","2021","2020/11/02","PMC7833476","NIHMS1659147","10.1016/j.neuroimage.2020.117517"
"32981657","Converging Structural and Functional Evidence for a Rat Salience Network","Tsai PJ, Keeley RJ, Carmack SA, Vendruscolo JCM, Lu H, Gu H, Vendruscolo LF, Koob GF, Lin CP, Stein EA, Yang Y.","Biol Psychiatry. 2020 Dec 1;88(11):867-878. doi: 10.1016/j.biopsych.2020.06.023. Epub 2020 Jul 2.","Tsai PJ","Biol Psychiatry","2020","2020/09/28","","","10.1016/j.biopsych.2020.06.023"
"32817555","Divergence of rodent and primate medial frontal cortex functional connectivity","Schaeffer DJ, Hori Y, Gilbert KM, Gati JS, Menon RS, Everling S.","Proc Natl Acad Sci U S A. 2020 Sep 1;117(35):21681-21689. doi: 10.1073/pnas.2003181117. Epub 2020 Aug 17.","Schaeffer DJ","Proc Natl Acad Sci U S A","2020","2020/08/21","PMC7474619","","10.1073/pnas.2003181117"
"32720701","Evolution of the speech-ready brain: The voice/jaw connection in the human motor cortex","Brown S, Yuan Y, Belyk M.","J Comp Neurol. 2021 Apr 1;529(5):1018-1028. doi: 10.1002/cne.24997. Epub 2020 Sep 8.","Brown S","J Comp Neurol","2021","2020/07/29","","","10.1002/cne.24997"
"32539526","Diagnostic Classification for Human Autism and Obsessive-Compulsive Disorder Based on Machine Learning From a Primate Genetic Model","Zhan Y, Wei J, Liang J, Xu X, He R, Robbins TW, Wang Z.","Am J Psychiatry. 2021 Jan 1;178(1):65-76. doi: 10.1176/appi.ajp.2020.19101091. Epub 2020 Jun 16.","Zhan Y","Am J Psychiatry","2021","2020/06/17","","","10.1176/appi.ajp.2020.19101091"
"32469053","Dynamic Reconfiguration, Fragmentation, and Integration of Whole-Brain Modular Structure across Depths of Unconsciousness","Standage D, Areshenkoff CN, Nashed JY, Hutchison RM, Hutchison M, Heinke D, Menon RS, Everling S, Gallivan JP.","Cereb Cortex. 2020 Sep 3;30(10):5229-5241. doi: 10.1093/cercor/bhaa085.","Standage D","Cereb Cortex","2020","2020/05/30","PMC7472202","","10.1093/cercor/bhaa085"
"32315894","Fasting may increase incentive signaling for nonfood rewards","Zhang X, Melrose AJ, De Santis O, Luo S, Page KA, Hsu E, Monterosso JR.","Nutr Res. 2020 May;77:43-53. doi: 10.1016/j.nutres.2020.02.013. Epub 2020 Mar 2.","Zhang X","Nutr Res","2020","2020/04/22","PMC7295658","NIHMS1570362","10.1016/j.nutres.2020.02.013"
"32139585","Resolving the Spatial Profile of Figure Enhancement in Human V1 through Population Receptive Field Modeling","Poltoratski S, Tong F.","J Neurosci. 2020 Apr 15;40(16):3292-3303. doi: 10.1523/JNEUROSCI.2377-19.2020. Epub 2020 Mar 5.","Poltoratski S","J Neurosci","2020","2020/03/07","PMC7159895","","10.1523/JNEUROSCI.2377-19.2020"
"32094202","Ultra-high-resolution fMRI of Human Ventral Temporal Cortex Reveals Differential Representation of Categories and Domains","Margalit E, Jamison KW, Weiner KS, Vizioli L, Zhang RY, Kay KN, Grill-Spector K.","J Neurosci. 2020 Apr 8;40(15):3008-3024. doi: 10.1523/JNEUROSCI.2106-19.2020. Epub 2020 Feb 24.","Margalit E","J Neurosci","2020","2020/02/26","PMC7141875","","10.1523/JNEUROSCI.2106-19.2020"
"31862856","Categorical Biases in Human Occipitoparietal Cortex","Ester EF, Sprague TC, Serences JT.","J Neurosci. 2020 Jan 22;40(4):917-931. doi: 10.1523/JNEUROSCI.2700-19.2019. Epub 2019 Dec 20.","Ester EF","J Neurosci","2020","2019/12/22","PMC6975303","","10.1523/JNEUROSCI.2700-19.2019"
"31825706","Transcranial alternating current stimulation attenuates BOLD adaptation and increases functional connectivity","Kar K, Ito T, Cole MW, Krekelberg B.","J Neurophysiol. 2020 Jan 1;123(1):428-438. doi: 10.1152/jn.00376.2019. Epub 2019 Dec 11.","Kar K","J Neurophysiol","2020","2019/12/12","PMC6985864","","10.1152/jn.00376.2019"
"31692192","Top-down versus bottom-up attention differentially modulate frontal-parietal connectivity","Bowling JT, Friston KJ, Hopfinger JB.","Hum Brain Mapp. 2020 Mar;41(4):928-942. doi: 10.1002/hbm.24850. Epub 2019 Nov 6.","Bowling JT","Hum Brain Mapp","2020","2019/11/07","PMC7267915","","10.1002/hbm.24850"
"31672243","Approach-Avoidance Conflict in Major Depressive Disorder: Congruent Neural Findings in Humans and Nonhuman Primates","Ironside M, Amemori KI, McGrath CL, Pedersen ML, Kang MS, Amemori S, Frank MJ, Graybiel AM, Pizzagalli DA.","Biol Psychiatry. 2020 Mar 1;87(5):399-408. doi: 10.1016/j.biopsych.2019.08.022. Epub 2019 Sep 6.","Ironside M","Biol Psychiatry","2020","2019/11/02","PMC7007869","NIHMS1539267","10.1016/j.biopsych.2019.08.022"
"31262949","Sex Differences in Cognitive Flexibility and Resting Brain Networks in Middle-Aged Marmosets","LaClair M, Febo M, Nephew B, Gervais NJ, Poirier G, Workman K, Chumachenko S, Payne L, Moore MC, King JA, Lacreuse A.","eNeuro. 2019 Jul 25;6(4):ENEURO.0154-19.2019. doi: 10.1523/ENEURO.0154-19.2019. Print 2019 Jul/Aug.","LaClair M","eNeuro","2019","2019/07/03","PMC6658914","","10.1523/ENEURO.0154-19.2019"
"31219563","From Synchrony to Asynchrony: Cerebellar-Basal Ganglia Functional Circuits in Young and Older Adults","Hausman HK, Jackson TB, Goen JRM, Bernard JA.","Cereb Cortex. 2020 Mar 21;30(2):718-729. doi: 10.1093/cercor/bhz121.","Hausman HK","Cereb Cortex","2020","2019/06/21","","","10.1093/cercor/bhz121"
"30867291","Estimating average single-neuron visual receptive field sizes by fMRI","Keliris GA, Li Q, Papanikolaou A, Logothetis NK, Smirnakis SM.","Proc Natl Acad Sci U S A. 2019 Mar 26;116(13):6425-6434. doi: 10.1073/pnas.1809612116. Epub 2019 Mar 13.","Keliris GA","Proc Natl Acad Sci U S A","2019","2019/03/15","PMC6442598","","10.1073/pnas.1809612116"
"30796824","Neurofeedback Training of Gamma Oscillations in Monkey Primary Visual Cortex","Chauvière L, Singer W.","Cereb Cortex. 2019 Dec 17;29(11):4785-4802. doi: 10.1093/cercor/bhz013.","Chauvière L","Cereb Cortex","2019","2019/02/24","","","10.1093/cercor/bhz013"
"30601693","Functionally distinct language and Theory of Mind networks are synchronized at rest and during language comprehension","Paunov AM, Blank IA, Fedorenko E.","J Neurophysiol. 2019 Apr 1;121(4):1244-1265. doi: 10.1152/jn.00619.2018. Epub 2019 Jan 2.","Paunov AM","J Neurophysiol","2019","2019/01/03","PMC6485726","","10.1152/jn.00619.2018"
"30530859","Changes in Endogenous Dopamine Induced by Methylphenidate Predict Functional Connectivity in Nonhuman Primates","Birn RM, Converse AK, Rajala AZ, Alexander AL, Block WF, McMillan AB, Christian BT, Filla CN, Murali D, Hurley SA, Jenison RL, Populin LC.","J Neurosci. 2019 Feb 20;39(8):1436-1444. doi: 10.1523/JNEUROSCI.2513-18.2018. Epub 2018 Dec 10.","Birn RM","J Neurosci","2019","2018/12/12","PMC6381257","","10.1523/JNEUROSCI.2513-18.2018"
"30395192","Homology and Specificity of Natural Sound-Encoding in Human and Monkey Auditory Cortex","Erb J, Armendariz M, De Martino F, Goebel R, Vanduffel W, Formisano E.","Cereb Cortex. 2019 Aug 14;29(9):3636-3650. doi: 10.1093/cercor/bhy243.","Erb J","Cereb Cortex","2019","2018/11/06","","","10.1093/cercor/bhy243"
"30355629","Functional MRI in Macaque Monkeys during Task Switching","Premereur E, Janssen P, Vanduffel W.","J Neurosci. 2018 Dec 12;38(50):10619-10630. doi: 10.1523/JNEUROSCI.1539-18.2018. Epub 2018 Oct 24.","Premereur E","J Neurosci","2018","2018/10/26","PMC6580658","","10.1523/JNEUROSCI.1539-18.2018"
"30267074","Human V2A: A map of the peripheral visual hemifield with functional connections to scene-selective cortex","Elshout JA, van den Berg AV, Haak KV.","J Vis. 2018 Sep 4;18(9):22. doi: 10.1167/18.9.22.","Elshout JA","J Vis","2018","2018/09/30","PMC6159387","","10.1167/18.9.22"
"30232039","Improved methods for MRI-compatible implants in nonhuman primates","Ortiz-Rios M, Haag M, Balezeau F, Frey S, Thiele A, Murphy K, Schmid MC.","J Neurosci Methods. 2018 Oct 1;308:377-389. doi: 10.1016/j.jneumeth.2018.09.013. Epub 2018 Sep 16.","Ortiz-Rios M","J Neurosci Methods","2018","2018/09/21","PMC6203806","","10.1016/j.jneumeth.2018.09.013"
"29951579","Foreground-Background Segmentation Revealed during Natural Image Viewing","Papale P, Leo A, Cecchetti L, Handjaras G, Kay KN, Pietrini P, Ricciardi E.","eNeuro. 2018 Jun 26;5(3):ENEURO.0075-18.2018. doi: 10.1523/ENEURO.0075-18.2018. eCollection 2018 May-Jun.","Papale P","eNeuro","2018","2018/06/29","PMC6019392","","10.1523/ENEURO.0075-18.2018"
"29870538","fMRI study of the role of glutamate NMDA receptor in the olfactory processing in monkeys","Zhao F, Holahan MA, Wang X, Uslaner JM, Houghton AK, Evelhoch JL, Winkelmann CT, Hines CDG.","PLoS One. 2018 Jun 5;13(6):e0198395. doi: 10.1371/journal.pone.0198395. eCollection 2018.","Zhao F","PLoS One","2018","2018/06/06","PMC5988321","","10.1371/journal.pone.0198395"
"29575494","Cortical depth profiles of luminance contrast responses in human V1 and V2 using 7 T fMRI","Marquardt I, Schneider M, Gulban OF, Ivanov D, Uludağ K.","Hum Brain Mapp. 2018 Jul;39(7):2812-2827. doi: 10.1002/hbm.24042. Epub 2018 Mar 25.","Marquardt I","Hum Brain Mapp","2018","2018/03/26","PMC6866457","","10.1002/hbm.24042"
"29263238","Attention Shifts Recruit the Monkey Default Mode Network","Arsenault JT, Caspari N, Vandenberghe R, Vanduffel W.","J Neurosci. 2018 Jan 31;38(5):1202-1217. doi: 10.1523/JNEUROSCI.1111-17.2017. Epub 2017 Dec 20.","Arsenault JT","J Neurosci","2018","2017/12/22","PMC6596261","","10.1523/JNEUROSCI.1111-17.2017"
"29145469","Development of visual cortical function in infant macaques: A BOLD fMRI study","Van Grootel TJ, Meeson A, Munk MHJ, Kourtzi Z, Movshon JA, Logothetis NK, Kiorpes L.","PLoS One. 2017 Nov 16;12(11):e0187942. doi: 10.1371/journal.pone.0187942. eCollection 2017.","Van Grootel TJ","PLoS One","2017","2017/11/18","PMC5690606","","10.1371/journal.pone.0187942"
"29050469","In Vivo [(18)F]GE-179 Brain Signal Does Not Show NMDA-Specific Modulation with Drug Challenges in Rodents and Nonhuman Primates","Schoenberger M, Schroeder FA, Placzek MS, Carter RL, Rosen BR, Hooker JM, Sander CY.","ACS Chem Neurosci. 2018 Feb 21;9(2):298-305. doi: 10.1021/acschemneuro.7b00327. Epub 2017 Nov 14.","Schoenberger M","ACS Chem Neurosci","2018","2017/10/21","PMC5894869","NIHMS944838","10.1021/acschemneuro.7b00327"
"28905408","Resting-state functional connectivity in the rat cervical spinal cord at 9.4 T","Wu TL, Wang F, Mishra A, Wilson GH 3rd, Byun N, Chen LM, Gore JC.","Magn Reson Med. 2018 May;79(5):2773-2783. doi: 10.1002/mrm.26905. Epub 2017 Sep 14.","Wu TL","Magn Reson Med","2018","2017/09/15","PMC5821555","NIHMS928552","10.1002/mrm.26905"
"28729159","What do we know about laminar connectivity?","Rockland KS.","Neuroimage. 2019 Aug 15;197:772-784. doi: 10.1016/j.neuroimage.2017.07.032. Epub 2017 Jul 17.","Rockland KS","Neuroimage","2019","2017/07/22","","","10.1016/j.neuroimage.2017.07.032"
"28716961","Structural Basis of Large-Scale Functional Connectivity in the Mouse","Grandjean J, Zerbi V, Balsters JH, Wenderoth N, Rudin M.","J Neurosci. 2017 Aug 23;37(34):8092-8101. doi: 10.1523/JNEUROSCI.0438-17.2017. Epub 2017 Jul 17.","Grandjean J","J Neurosci","2017","2017/07/19","PMC6596781","","10.1523/JNEUROSCI.0438-17.2017"
"28612373","Reduced reward-related neural response to mimicry in individuals with autism","Hsu CT, Neufeld J, Chakrabarti B.","Eur J Neurosci. 2018 Mar;47(6):610-618. doi: 10.1111/ejn.13620. Epub 2017 Jul 12.","Hsu CT","Eur J Neurosci","2018","2017/06/15","PMC5900892","","10.1111/ejn.13620"
"28461461","High spatial correspondence at a columnar level between activation and resting state fMRI signals and local field potentials","Shi Z, Wu R, Yang PF, Wang F, Wu TL, Mishra A, Chen LM, Gore JC.","Proc Natl Acad Sci U S A. 2017 May 16;114(20):5253-5258. doi: 10.1073/pnas.1620520114. Epub 2017 May 1.","Shi Z","Proc Natl Acad Sci U S A","2017","2017/05/03","PMC5441782","","10.1073/pnas.1620520114"
"28258716","Functional interactions between the macaque dorsal and ventral visual pathways during three-dimensional object vision","Janssen P, Verhoef BE, Premereur E.","Cortex. 2018 Jan;98:218-227. doi: 10.1016/j.cortex.2017.01.021. Epub 2017 Feb 3.","Janssen P","Cortex","2018","2017/03/05","","","10.1016/j.cortex.2017.01.021"
"28202786","Dopamine Modulates Adaptive Prediction Error Coding in the Human Midbrain and Striatum","Diederen KM, Ziauddeen H, Vestergaard MD, Spencer T, Schultz W, Fletcher PC.","J Neurosci. 2017 Feb 15;37(7):1708-1720. doi: 10.1523/JNEUROSCI.1979-16.2016.","Diederen KM","J Neurosci","2017","2017/02/17","PMC5320604","","10.1523/JNEUROSCI.1979-16.2016"
"27535906","A Putative Multiple-Demand System in the Macaque Brain","Mitchell DJ, Bell AH, Buckley MJ, Mitchell AS, Sallet J, Duncan J.","J Neurosci. 2016 Aug 17;36(33):8574-85. doi: 10.1523/JNEUROSCI.0810-16.2016.","Mitchell DJ","J Neurosci","2016","2016/08/19","PMC4987434","","10.1523/JNEUROSCI.0810-16.2016"
"27501382","Design and implementation of embedded 8-channel receive-only arrays for whole-brain MRI and fMRI of conscious awake marmosets","Papoti D, Yen CC, Hung CC, Ciuchta J, Leopold DA, Silva AC.","Magn Reson Med. 2017 Jul;78(1):387-398. doi: 10.1002/mrm.26339. Epub 2016 Aug 8.","Papoti D","Magn Reson Med","2017","2016/08/09","PMC5298952","NIHMS797550","10.1002/mrm.26339"
"27488625","Contributions of the Central Extended Amygdala to Fear and Anxiety","Shackman AJ, Fox AS.","J Neurosci. 2016 Aug 3;36(31):8050-63. doi: 10.1523/JNEUROSCI.0982-16.2016.","Shackman AJ","J Neurosci","2016","2016/08/05","PMC4971357","","10.1523/JNEUROSCI.0982-16.2016"
"27383603","Global Motion Processing in Human Visual Cortical Areas V2 and V3","Furlan M, Smith AT.","J Neurosci. 2016 Jul 6;36(27):7314-24. doi: 10.1523/JNEUROSCI.0025-16.2016.","Furlan M","J Neurosci","2016","2016/07/08","PMC6705536","","10.1523/JNEUROSCI.0025-16.2016"
"27309348","Distinct BOLD fMRI Responses of Capsaicin-Induced Thermal Sensation Reveal Pain-Related Brain Activation in Nonhuman Primates","Asad AB, Seah S, Baumgartner R, Feng D, Jensen A, Manigbas E, Henry B, Houghton A, Evelhoch JL, Derbyshire SW, Chin CL.","PLoS One. 2016 Jun 16;11(6):e0156805. doi: 10.1371/journal.pone.0156805. eCollection 2016.","Asad AB","PLoS One","2016","2016/06/17","PMC4911046","","10.1371/journal.pone.0156805"
"26973476","Functional Connectivity Hubs and Networks in the Awake Marmoset Brain","Belcher AM, Yen CC, Notardonato L, Ross TJ, Volkow ND, Yang Y, Stein EA, Silva AC, Tomasi D.","Front Integr Neurosci. 2016 Mar 4;10:9. doi: 10.3389/fnint.2016.00009. eCollection 2016.","Belcher AM","Front Integr Neurosci","2016","2016/03/15","PMC4777715","","10.3389/fnint.2016.00009"
"26966119","A proof-of-concept, randomized controlled trial of DAR-0100A, a dopamine-1 receptor agonist, for cognitive enhancement in schizophrenia","Girgis RR, Van Snellenberg JX, Glass A, Kegeles LS, Thompson JL, Wall M, Cho RY, Carter CS, Slifstein M, Abi-Dargham A, Lieberman JA.","J Psychopharmacol. 2016 May;30(5):428-35. doi: 10.1177/0269881116636120. Epub 2016 Mar 10.","Girgis RR","J Psychopharmacol","2016","2016/03/12","","","10.1177/0269881116636120"
"26908365","Connectivity between the central nucleus of the amygdala and the bed nucleus of the stria terminalis in the non-human primate: neuronal tract tracing and developmental neuroimaging studies","Oler JA, Tromp DP, Fox AS, Kovner R, Davidson RJ, Alexander AL, McFarlin DR, Birn RM, E Berg B, deCampo DM, Kalin NH, Fudge JL.","Brain Struct Funct. 2017 Jan;222(1):21-39. doi: 10.1007/s00429-016-1198-9. Epub 2016 Feb 23.","Oler JA","Brain Struct Funct","2017","2016/02/25","PMC4995160","NIHMS762902","10.1007/s00429-016-1198-9"
"26865609","Interdigitated Color- and Disparity-Selective Columns within Human Visual Cortical Areas V2 and V3","Nasr S, Polimeni JR, Tootell RB.","J Neurosci. 2016 Feb 10;36(6):1841-57. doi: 10.1523/JNEUROSCI.3518-15.2016.","Nasr S","J Neurosci","2016","2016/02/12","PMC4748071","","10.1523/JNEUROSCI.3518-15.2016"
"26843649","Color-Biased Regions of the Ventral Visual Pathway Lie between Face- and Place-Selective Regions in Humans, as in Macaques","Lafer-Sousa R, Conway BR, Kanwisher NG.","J Neurosci. 2016 Feb 3;36(5):1682-97. doi: 10.1523/JNEUROSCI.3164-15.2016.","Lafer-Sousa R","J Neurosci","2016","2016/02/05","PMC4737777","","10.1523/JNEUROSCI.3164-15.2016"
"26467643","Essential tremor is associated with disruption of functional connectivity in the ventral intermediate Nucleus--Motor Cortex--Cerebellum circuit","Fang W, Chen H, Wang H, Zhang H, Puneet M, Liu M, Lv F, Luo T, Cheng O, Wang X, Lu X.","Hum Brain Mapp. 2016 Jan;37(1):165-78. doi: 10.1002/hbm.23024. Epub 2015 Oct 15.","Fang W","Hum Brain Mapp","2016","2015/10/16","PMC6867464","","10.1002/hbm.23024"
"26467517","Tactile representation of the head and shoulders assessed by fMRI in the nonhuman primate","Wardak C, Guipponi O, Pinède S, Ben Hamed S.","J Neurophysiol. 2016 Jan 1;115(1):80-91. doi: 10.1152/jn.00633.2015. Epub 2015 Oct 14.","Wardak C","J Neurophysiol","2016","2015/10/16","PMC4760502","","10.1152/jn.00633.2015"
"26354907","Discrimination of Visual Categories Based on Behavioral Relevance in Widespread Regions of Frontoparietal Cortex","Erez Y, Duncan J.","J Neurosci. 2015 Sep 9;35(36):12383-93. doi: 10.1523/JNEUROSCI.1134-15.2015.","Erez Y","J Neurosci","2015","2015/09/11","PMC4563032","","10.1523/JNEUROSCI.1134-15.2015"
"26290449","Resting-state functional connectivity in the baboon model of genetic generalized epilepsy","Salinas FS, Szabó CÁ.","Epilepsia. 2015 Oct;56(10):1580-9. doi: 10.1111/epi.13115. Epub 2015 Aug 20.","Salinas FS","Epilepsia","2015","2015/08/21","PMC4593742","NIHMS708606","10.1111/epi.13115"
"26239105","A problem of overlap","Tootell RB, Echavarria C, Nasr S.","Vis Neurosci. 2015 Jan;32:E001. doi: 10.1017/S0952523814000340.","Tootell RB","Vis Neurosci","2015","2015/08/05","PMC5678273","","10.1017/S0952523814000340"
"26203144","Differential fMRI Activation Patterns to Noxious Heat and Tactile Stimuli in the Primate Spinal Cord","Yang PF, Wang F, Chen LM.","J Neurosci. 2015 Jul 22;35(29):10493-502. doi: 10.1523/JNEUROSCI.0583-15.2015.","Yang PF","J Neurosci","2015","2015/07/24","PMC4510289","","10.1523/JNEUROSCI.0583-15.2015"
"26156987","The Anatomical and Functional Organization of the Human Visual Pulvinar","Arcaro MJ, Pinsk MA, Kastner S.","J Neurosci. 2015 Jul 8;35(27):9848-71. doi: 10.1523/JNEUROSCI.1575-14.2015.","Arcaro MJ","J Neurosci","2015","2015/07/10","PMC4495241","","10.1523/JNEUROSCI.1575-14.2015"
"26149609","Functional MRI of visual responses in the awake, behaving marmoset","Hung CC, Yen CC, Ciuchta JL, Papoti D, Bock NA, Leopold DA, Silva AC.","Neuroimage. 2015 Oct 15;120:1-11. doi: 10.1016/j.neuroimage.2015.06.090. Epub 2015 Jul 3.","Hung CC","Neuroimage","2015","2015/07/08","PMC4589494","NIHMS711899","10.1016/j.neuroimage.2015.06.090"
"26052749","Functional subregions of the human entorhinal cortex","Maass A, Berron D, Libby LA, Ranganath C, Düzel E.","Elife. 2015 Jun 8;4:e06426. doi: 10.7554/eLife.06426.","Maass A","Elife","2015","2015/06/09","PMC4458841","","10.7554/eLife.06426"
"26041830","Activity in the human superior colliculus relating to endogenous saccade preparation and execution","Furlan M, Smith AT, Walker R.","J Neurophysiol. 2015 Aug;114(2):1048-58. doi: 10.1152/jn.00825.2014. Epub 2015 Jun 3.","Furlan M","J Neurophysiol","2015","2015/06/05","PMC4725108","","10.1152/jn.00825.2014"
"26029069","Aggressive vocal expressions-an investigation of their underlying neural network","Klaas HS, Frühholz S, Grandjean D.","Front Behav Neurosci. 2015 May 11;9:121. doi: 10.3389/fnbeh.2015.00121. eCollection 2015.","Klaas HS","Front Behav Neurosci","2015","2015/06/02","PMC4426728","","10.3389/fnbeh.2015.00121"
"25970649","Functional subdivisions of medial parieto-occipital cortex in humans and nonhuman primates using resting-state fMRI","Hutchison RM, Culham JC, Flanagan JR, Everling S, Gallivan JP.","Neuroimage. 2015 Aug 1;116:10-29. doi: 10.1016/j.neuroimage.2015.04.068. Epub 2015 May 10.","Hutchison RM","Neuroimage","2015","2015/05/14","","","10.1016/j.neuroimage.2015.04.068"
"25390202","Tolerance of macaque middle STS body patch neurons to shape-preserving stimulus transformations","Popivanov ID, Jastorff J, Vanduffel W, Vogels R.","J Cogn Neurosci. 2015 May;27(5):1001-16. doi: 10.1162/jocn_a_00762. Epub 2014 Nov 12.","Popivanov ID","J Cogn Neurosci","2015","2014/11/13","","","10.1162/jocn_a_00762"
"25375136","Deep supervised, but not unsupervised, models may explain IT cortical representation","Khaligh-Razavi SM, Kriegeskorte N.","PLoS Comput Biol. 2014 Nov 6;10(11):e1003915. doi: 10.1371/journal.pcbi.1003915. eCollection 2014 Nov.","Khaligh-Razavi SM","PLoS Comput Biol","2014","2014/11/07","PMC4222664","","10.1371/journal.pcbi.1003915"
"25224997","Understanding human original actions directed at real-world goals: the role of the lateral prefrontal cortex","Sitnikova T, Rosen BR, Lord LD, West WC.","Neuroimage. 2014 Dec;103:91-105. doi: 10.1016/j.neuroimage.2014.09.012. Epub 2014 Sep 16.","Sitnikova T","Neuroimage","2014","2014/09/17","PMC4312188","NIHMS628219","10.1016/j.neuroimage.2014.09.012"
"25009268","Parallel functional reorganizations of somatosensory areas 3b and 1, and S2 following spinal cord injury in squirrel monkeys","Yang PF, Qi HX, Kaas JH, Chen LM.","J Neurosci. 2014 Jul 9;34(28):9351-63. doi: 10.1523/JNEUROSCI.0537-14.2014.","Yang PF","J Neurosci","2014","2014/07/11","PMC4087212","","10.1523/JNEUROSCI.0537-14.2014"
"24933029","Subthalamic nucleus deep brain stimulation induces motor network BOLD activation: use of a high precision MRI guided stereotactic system for nonhuman primates","Min HK, Ross EK, Lee KH, Dennis K, Han SR, Jeong JH, Marsh MP, Striemer B, Felmlee JP, Lujan JL, Goerss S, Duffy PS, Blaha C, Chang SY, Bennet KE.","Brain Stimul. 2014 Jul-Aug;7(4):603-607. doi: 10.1016/j.brs.2014.04.007. Epub 2014 May 2.","Min HK","Brain Stimul","2014","2014/06/17","PMC4108508","NIHMS603271","10.1016/j.brs.2014.04.007"
"24893745","Retinotopy versus face selectivity in macaque visual cortex","Rajimehr R, Bilenko NY, Vanduffel W, Tootell RB.","J Cogn Neurosci. 2014 Dec;26(12):2691-700. doi: 10.1162/jocn_a_00672. Epub 2014 Jun 4.","Rajimehr R","J Cogn Neurosci","2014","2014/06/05","","","10.1162/jocn_a_00672"
"24790190","The anterior cingulate gyrus signals the net value of others' rewards","Apps MA, Ramnani N.","J Neurosci. 2014 Apr 30;34(18):6190-200. doi: 10.1523/JNEUROSCI.2701-13.2014.","Apps MA","J Neurosci","2014","2014/05/03","PMC4004808","","10.1523/JNEUROSCI.2701-13.2014"
"24523555","Representation of the material properties of objects in the visual cortex of nonhuman primates","Goda N, Tachibana A, Okazawa G, Komatsu H.","J Neurosci. 2014 Feb 12;34(7):2660-73. doi: 10.1523/JNEUROSCI.2593-13.2014.","Goda N","J Neurosci","2014","2014/02/14","PMC6802747","","10.1523/JNEUROSCI.2593-13.2014"
