PMID,Title,Authors,Citation,First Author,Journal/Book,Publication Year,Create Date,PMCID,NIHMS ID,DOI
"34271158","Functional networks in non-human primate spinal cord and the effects of injury","Sengupta A, Mishra A, Wang F, Li M, Yang PF, Chen LM, Gore JC.","Neuroimage. 2021 Jul 14;240:118391. doi: 10.1016/j.neuroimage.2021.118391. Online ahead of print.","Sengupta A","Neuroimage","2021","2021/07/16","","","10.1016/j.neuroimage.2021.118391"
"34048898","Common functional localizers to enhance NHP & cross-species neuroscience imaging research","Russ BE, Petkov CI, Kwok SC, Zhu Q, Belin P, Vanduffel W, Hamed SB.","Neuroimage. 2021 Aug 15;237:118203. doi: 10.1016/j.neuroimage.2021.118203. Epub 2021 May 25.","Russ BE","Neuroimage","2021","2021/05/28","","","10.1016/j.neuroimage.2021.118203"
"33794355","Combining brain perturbation and neuroimaging in non-human primates","Klink PC, Aubry JF, Ferrera VP, Fox AS, Froudist-Walsh S, Jarraya B, Konofagou EE, Krauzlis RJ, Messinger A, Mitchell AS, Ortiz-Rios M, Oya H, Roberts AC, Roe AW, Rushworth MFS, Sallet J, Schmid MC, Schroeder CE, Tasserie J, Tsao DY, Uhrig L, Vanduffel W, Wilke M, Kagan I, Petkov CI.","Neuroimage. 2021 Jul 15;235:118017. doi: 10.1016/j.neuroimage.2021.118017. Epub 2021 Mar 29.","Klink PC","Neuroimage","2021","2021/04/01","","","10.1016/j.neuroimage.2021.118017"
"33789138","A comprehensive macaque fMRI pipeline and hierarchical atlas","Jung B, Taylor PA, Seidlitz J, Sponheim C, Perkins P, Ungerleider LG, Glen D, Messinger A.","Neuroimage. 2021 Jul 15;235:117997. doi: 10.1016/j.neuroimage.2021.117997. Epub 2021 Mar 28.","Jung B","Neuroimage","2021","2021/03/31","","","10.1016/j.neuroimage.2021.117997"
"33338613","Altered hippocampal-prefrontal functional network integrity in adult macaque monkeys with neonatal hippocampal lesions","Li CX, Li Z, Hu X, Zhang X, Bachevalier J.","Neuroimage. 2021 Feb 15;227:117645. doi: 10.1016/j.neuroimage.2020.117645. Epub 2020 Dec 15.","Li CX","Neuroimage","2021","2020/12/18","","","10.1016/j.neuroimage.2020.117645"
"33137476","The role of MRI in applying the 3Rs to non-human primate neuroscience","Prescott MJ, Poirier C.","Neuroimage. 2021 Jan 15;225:117521. doi: 10.1016/j.neuroimage.2020.117521. Epub 2020 Nov 1.","Prescott MJ","Neuroimage","2021","2020/11/02","","","10.1016/j.neuroimage.2020.117521"
"33099005","Cortical hierarchy, dual counterstream architecture and the importance of top-down generative networks","Vezoli J, Magrou L, Goebel R, Wang XJ, Knoblauch K, Vinck M, Kennedy H.","Neuroimage. 2021 Jan 15;225:117479. doi: 10.1016/j.neuroimage.2020.117479. Epub 2020 Oct 21.","Vezoli J","Neuroimage","2021","2020/10/25","PMC8244994","NIHMS1713738","10.1016/j.neuroimage.2020.117479"
"32960419","MRI-based Parcellation and Morphometry of the Individual Rhesus Monkey Brain: the macaque Harvard-Oxford Atlas (mHOA), a translational system referencing a standardized ontology","Rushmore RJ, Bouix S, Kubicki M, Rathi Y, Rosene DL, Yeterian EH, Makris N.","Brain Imaging Behav. 2021 Jun;15(3):1589-1621. doi: 10.1007/s11682-020-00357-9.","Rushmore RJ","Brain Imaging Behav","2021","2020/09/22","","","10.1007/s11682-020-00357-9"
"32888082","Application of Pharmacokinetic-Pharmacodynamic Modeling to Inform Translation of In Vitro NaV1.7 Inhibition to In Vivo Pharmacological Response in Non-human Primate","Ballard JE, Pall P, Vardigan J, Zhao F, Holahan MA, Kraus R, Li Y, Henze D, Houghton A, Burgey CS, Gibson C.","Pharm Res. 2020 Sep 4;37(10):181. doi: 10.1007/s11095-020-02914-9.","Ballard JE","Pharm Res","2020","2020/09/05","PMC7473964","","10.1007/s11095-020-02914-9"
"32315710","Examining fMRI time-series entropy as a marker for brain E/I balance with pharmacological neuromodulation in a non-human primate translational model","Maltbie EA, Howell LH, Sun PZ, Miller R, Gopinath KS.","Neurosci Lett. 2020 May 29;728:134984. doi: 10.1016/j.neulet.2020.134984. Epub 2020 Apr 18.","Maltbie EA","Neurosci Lett","2020","2020/04/22","PMC7266677","NIHMS1593985","10.1016/j.neulet.2020.134984"
"32132562","Repetition enhancement to voice identities in the dog brain","Boros M, Gábor A, Szabó D, Bozsik A, Gácsi M, Szalay F, Faragó T, Andics A.","Sci Rep. 2020 Mar 4;10(1):3989. doi: 10.1038/s41598-020-60395-7.","Boros M","Sci Rep","2020","2020/03/06","PMC7055288","","10.1038/s41598-020-60395-7"
"32038217","Animal Functional Magnetic Resonance Imaging: Trends and Path Toward Standardization","Mandino F, Cerri DH, Garin CM, Straathof M, van Tilborg GAF, Chakravarty MM, Dhenain M, Dijkhuizen RM, Gozzi A, Hess A, Keilholz SD, Lerch JP, Shih YI, Grandjean J.","Front Neuroinform. 2020 Jan 22;13:78. doi: 10.3389/fninf.2019.00078. eCollection 2019.","Mandino F","Front Neuroinform","2020","2020/02/11","PMC6987455","","10.3389/fninf.2019.00078"
"31858422","Effects of Chronic Ephedrine Toxicity on Functional Connections, Cell Apoptosis, and CREB-Related Proteins in the Prefrontal Cortex of Rhesus Monkeys","Duan S, Ma Y, Xie L, Zheng L, Huang J, Guo R, Sun Z, Xie Y, Lv J, Lin Z, Ma S.","Neurotox Res. 2020 Mar;37(3):602-615. doi: 10.1007/s12640-019-00146-3. Epub 2019 Dec 20.","Duan S","Neurotox Res","2020","2019/12/21","","","10.1007/s12640-019-00146-3"
"31743789","Pypreclin: An automatic pipeline for macaque functional MRI preprocessing","Tasserie J, Grigis A, Uhrig L, Dupont M, Amadon A, Jarraya B.","Neuroimage. 2020 Feb 15;207:116353. doi: 10.1016/j.neuroimage.2019.116353. Epub 2019 Nov 16.","Tasserie J","Neuroimage","2020","2019/11/20","","","10.1016/j.neuroimage.2019.116353"
"31619951","fMRI in Non-human Primate: A Review on Factors That Can Affect Interpretation and Dynamic Causal Modeling Application","Jovellar DB, Doudet DJ.","Front Neurosci. 2019 Sep 18;13:973. doi: 10.3389/fnins.2019.00973. eCollection 2019.","Jovellar DB","Front Neurosci","2019","2019/10/18","PMC6759819","","10.3389/fnins.2019.00973"
"31394491","A preliminary study of association between adolescent estradiol level and dorsolateral prefrontal cortex activity during emotion regulation","Chung YS, Poppe A, Novotny S, Epperson CN, Kober H, Granger DA, Blumberg HP, Ochsner K, Gross JJ, Pearlson G, Stevens MC.","Psychoneuroendocrinology. 2019 Nov;109:104398. doi: 10.1016/j.psyneuen.2019.104398. Epub 2019 Jul 30.","Chung YS","Psychoneuroendocrinology","2019","2019/08/09","PMC6842698","NIHMS1537095","10.1016/j.psyneuen.2019.104398"
"30926817","Intrinsic functional architecture of the non-human primate spinal cord derived from fMRI and electrophysiology","Wu TL, Yang PF, Wang F, Shi Z, Mishra A, Wu R, Chen LM, Gore JC.","Nat Commun. 2019 Mar 29;10(1):1416. doi: 10.1038/s41467-019-09485-3.","Wu TL","Nat Commun","2019","2019/03/31","PMC6440970","","10.1038/s41467-019-09485-3"
"30822717","Validations of apomorphine-induced BOLD activation correlations in hemiparkinsonian rhesus macaques","Quintero JE, Ai Y, Andersen AH, Hardy P, Grondin R, Guduru Z, Gash DM, Gerhardt GA, Zhang Z.","Neuroimage Clin. 2019;22:101724. doi: 10.1016/j.nicl.2019.101724. Epub 2019 Feb 18.","Quintero JE","Neuroimage Clin","2019","2019/03/02","PMC6396014","","10.1016/j.nicl.2019.101724"
"30597044","Pain-related behavior and brain activation in cynomolgus macaques with naturally occurring endometriosis","Yano M, Matsuda A, Natsume T, Ogawa S, Awaga Y, Hayashi I, Hama A, Takamatsu H.","Hum Reprod. 2019 Mar 1;34(3):469-478. doi: 10.1093/humrep/dey383.","Yano M","Hum Reprod","2019","2019/01/01","","","10.1093/humrep/dey383"
"30566918","A surface loop array for in vivo small animal MRI/fMRI on 7T human scanners","Gao Y, Wang P, Qian M, Zhao J, Xu H, Zhang X.","Phys Med Biol. 2019 Jan 24;64(3):035009. doi: 10.1088/1361-6560/aaf9e4.","Gao Y","Phys Med Biol","2019","2018/12/20","","","10.1088/1361-6560/aaf9e4"
"30205207","Resting-state white matter-cortical connectivity in non-human primate brain","Wu TL, Wang F, Li M, Schilling KG, Gao Y, Anderson AW, Chen LM, Ding Z, Gore JC.","Neuroimage. 2019 Jan 1;184:45-55. doi: 10.1016/j.neuroimage.2018.09.021. Epub 2018 Sep 8.","Wu TL","Neuroimage","2019","2018/09/12","PMC6250128","NIHMS1506840","10.1016/j.neuroimage.2018.09.021"
"30131679","Representation of Spatial and Feature Information in the Monkey Dorsal and Ventral Prefrontal Cortex","Constantinidis C, Qi XL.","Front Integr Neurosci. 2018 Aug 7;12:31. doi: 10.3389/fnint.2018.00031. eCollection 2018.","Constantinidis C","Front Integr Neurosci","2018","2018/08/23","PMC6090048","","10.3389/fnint.2018.00031"
"30121000","Adaptive coding in the human brain: Distinct object features are encoded by overlapping voxels in frontoparietal cortex","Jackson JB, Woolgar A.","Cortex. 2018 Nov;108:25-34. doi: 10.1016/j.cortex.2018.07.006. Epub 2018 Jul 25.","Jackson JB","Cortex","2018","2018/08/19","PMC6629547","EMS83377","10.1016/j.cortex.2018.07.006"
"30107259","Content-specific codes of parametric auditory working memory in humans","Uluç I, Schmidt TT, Wu YH, Blankenburg F.","Neuroimage. 2018 Dec;183:254-262. doi: 10.1016/j.neuroimage.2018.08.024. Epub 2018 Aug 11.","Uluç I","Neuroimage","2018","2018/08/15","","","10.1016/j.neuroimage.2018.08.024"
"30017395","Functional Networks for Social Communication in the Macaque Monkey","Shepherd SV, Freiwald WA.","Neuron. 2018 Jul 25;99(2):413-420.e3. doi: 10.1016/j.neuron.2018.06.027. Epub 2018 Jul 12.","Shepherd SV","Neuron","2018","2018/07/19","PMC6449102","NIHMS1506208","10.1016/j.neuron.2018.06.027"
"29679734","Cortical networks for encoding near and far space in the non-human primate","Cléry J, Guipponi O, Odouard S, Wardak C, Ben Hamed S.","Neuroimage. 2018 Aug 1;176:164-178. doi: 10.1016/j.neuroimage.2018.04.036. Epub 2018 Apr 19.","Cléry J","Neuroimage","2018","2018/04/22","","","10.1016/j.neuroimage.2018.04.036"
"29642002","Delineating the Macroscale Areal Organization of the Macaque Cortex In Vivo","Xu T, Falchier A, Sullivan EL, Linn G, Ramirez JSB, Ross D, Feczko E, Opitz A, Bagley J, Sturgeon D, Earl E, Miranda-Domínguez O, Perrone A, Craddock RC, Schroeder CE, Colcombe S, Fair DA, Milham MP.","Cell Rep. 2018 Apr 10;23(2):429-441. doi: 10.1016/j.celrep.2018.03.049.","Xu T","Cell Rep","2018","2018/04/12","PMC6157013","NIHMS961950","10.1016/j.celrep.2018.03.049"
"29285809","Investigation of the BOLD and CBV fMRI responses to somatosensory stimulation in awake marmosets (Callithrix jacchus)","Hirano Y, Yen CC, Liu JV, Mackel JB, Merkle H, Nascimento GC, Stefanovic B, Silva AC.","NMR Biomed. 2018 Mar;31(3):10.1002/nbm.3864. doi: 10.1002/nbm.3864. Epub 2017 Dec 29.","Hirano Y","NMR Biomed","2018","2017/12/30","PMC5841465","NIHMS939537","10.1002/nbm.3864"
"29208569","A digital 3D atlas of the marmoset brain based on multi-modal MRI","Liu C, Ye FQ, Yen CC, Newman JD, Glen D, Leopold DA, Silva AC.","Neuroimage. 2018 Apr 1;169:106-116. doi: 10.1016/j.neuroimage.2017.12.004. Epub 2017 Dec 5.","Liu C","Neuroimage","2018","2017/12/07","PMC5856608","NIHMS928414","10.1016/j.neuroimage.2017.12.004"
"29130062","Human spatial navigation: Representations across dimensions and scales","Ekstrom AD, Isham EA.","Curr Opin Behav Sci. 2017 Oct;17:84-89. doi: 10.1016/j.cobeha.2017.06.005. Epub 2017 Sep 21.","Ekstrom AD","Curr Opin Behav Sci","2017","2017/11/14","PMC5678987","NIHMS890394","10.1016/j.cobeha.2017.06.005"
"29107771","Overlapping frontoparietal networks for tactile and visual parametric working memory representations","Wu YH, Uluç I, Schmidt TT, Tertel K, Kirilina E, Blankenburg F.","Neuroimage. 2018 Feb 1;166:325-334. doi: 10.1016/j.neuroimage.2017.10.059. Epub 2017 Oct 28.","Wu YH","Neuroimage","2018","2017/11/07","","","10.1016/j.neuroimage.2017.10.059"
"28466257","Cortical Representation of Pain and Touch: Evidence from Combined Functional Neuroimaging and Electrophysiology in Non-human Primates","Chen LM.","Neurosci Bull. 2018 Feb;34(1):165-177. doi: 10.1007/s12264-017-0133-2. Epub 2017 May 2.","Chen LM","Neurosci Bull","2018","2017/05/04","PMC5799120","","10.1007/s12264-017-0133-2"
"28213112","Laminar imaging of positive and negative BOLD in human visual cortex at 7T","Fracasso A, Luijten PR, Dumoulin SO, Petridou N.","Neuroimage. 2018 Jan 1;164:100-111. doi: 10.1016/j.neuroimage.2017.02.038. Epub 2017 Feb 14.","Fracasso A","Neuroimage","2018","2017/02/19","","","10.1016/j.neuroimage.2017.02.038"
"27803286","The neural basis of understanding the expression of the emotions in man and animals","Spunt RP, Ellsworth E, Adolphs R.","Soc Cogn Affect Neurosci. 2017 Jan 1;12(1):95-105. doi: 10.1093/scan/nsw161.","Spunt RP","Soc Cogn Affect Neurosci","2017","2016/11/03","PMC5390760","","10.1093/scan/nsw161"
"27091582","Correlated inter-regional variations in low frequency local field potentials and resting state BOLD signals within S1 cortex of monkeys","Wilson GH 3rd, Yang PF, Gore JC, Chen LM.","Hum Brain Mapp. 2016 Aug;37(8):2755-66. doi: 10.1002/hbm.23207. Epub 2016 Apr 19.","Wilson GH 3rd","Hum Brain Mapp","2016","2016/04/20","PMC4945372","NIHMS773165","10.1002/hbm.23207"
"27031602","Non-human primates in neuroscience research: The case against its scientific necessity","Bailey J, Taylor K.","Altern Lab Anim. 2016 Mar;44(1):43-69. doi: 10.1177/026119291604400101.","Bailey J","Altern Lab Anim","2016","2016/04/01","","","10.1177/026119291604400101"
"26908365","Connectivity between the central nucleus of the amygdala and the bed nucleus of the stria terminalis in the non-human primate: neuronal tract tracing and developmental neuroimaging studies","Oler JA, Tromp DP, Fox AS, Kovner R, Davidson RJ, Alexander AL, McFarlin DR, Birn RM, E Berg B, deCampo DM, Kalin NH, Fudge JL.","Brain Struct Funct. 2017 Jan;222(1):21-39. doi: 10.1007/s00429-016-1198-9. Epub 2016 Feb 23.","Oler JA","Brain Struct Funct","2017","2016/02/25","PMC4995160","NIHMS762902","10.1007/s00429-016-1198-9"
"26635539","In Vivo Mapping of Cortical Columnar Networks in the Monkey with Focal Electrical and Optical Stimulation","Roe AW, Chernov MM, Friedman RM, Chen G.","Front Neuroanat. 2015 Nov 16;9:135. doi: 10.3389/fnana.2015.00135. eCollection 2015.","Roe AW","Front Neuroanat","2015","2015/12/05","PMC4644798","","10.3389/fnana.2015.00135"
"25988226","Whole brain mapping of visual and tactile convergence in the macaque monkey","Guipponi O, Cléry J, Odouard S, Wardak C, Ben Hamed S.","Neuroimage. 2015 Aug 15;117:93-102. doi: 10.1016/j.neuroimage.2015.05.022. Epub 2015 May 16.","Guipponi O","Neuroimage","2015","2015/05/20","","","10.1016/j.neuroimage.2015.05.022"
"25876179","Neural coding within human brain areas involved in actions","Gallivan JP, Culham JC.","Curr Opin Neurobiol. 2015 Aug;33:141-9. doi: 10.1016/j.conb.2015.03.012. Epub 2015 Apr 11.","Gallivan JP","Curr Opin Neurobiol","2015","2015/04/16","","","10.1016/j.conb.2015.03.012"
"25192653","Quantification of iron in the non-human primate brain with diffusion-weighted magnetic resonance imaging","Fujiwara S, Uhrig L, Amadon A, Jarraya B, Le Bihan D.","Neuroimage. 2014 Nov 15;102 Pt 2:789-97. doi: 10.1016/j.neuroimage.2014.08.049. Epub 2014 Sep 2.","Fujiwara S","Neuroimage","2014","2014/09/07","","","10.1016/j.neuroimage.2014.08.049"
"25094017","The human amygdala encodes value and space during decision making","Ousdal OT, Specht K, Server A, Andreassen OA, Dolan RJ, Jensen J.","Neuroimage. 2014 Nov 1;101:712-9. doi: 10.1016/j.neuroimage.2014.07.055. Epub 2014 Aug 2.","Ousdal OT","Neuroimage","2014","2014/08/06","PMC4176653","","10.1016/j.neuroimage.2014.07.055"
"24629510","Fractional amplitude of low-frequency fluctuation changes in monkeys with spinal cord injury: a resting-state fMRI study","Rao JS, Ma M, Zhao C, Zhang AF, Yang ZY, Liu Z, Li XG.","Magn Reson Imaging. 2014 Jun;32(5):482-6. doi: 10.1016/j.mri.2014.02.001. Epub 2014 Feb 10.","Rao JS","Magn Reson Imaging","2014","2014/03/18","","","10.1016/j.mri.2014.02.001"
"24121168","The helmet head restraint system: a viable solution for resting state fMRI in awake monkeys","Hadj-Bouziane F, Monfardini E, Guedj C, Gardechaux G, Hynaux C, Farnè A, Meunier M.","Neuroimage. 2014 Feb 1;86:536-43. doi: 10.1016/j.neuroimage.2013.09.068. Epub 2013 Oct 8.","Hadj-Bouziane F","Neuroimage","2014","2013/10/15","","","10.1016/j.neuroimage.2013.09.068"
"23716429","Magnetic resonance imaging of the retina: from mice to men","Duong TQ.","Magn Reson Med. 2014 Apr;71(4):1526-30. doi: 10.1002/mrm.24797. Epub 2013 May 28.","Duong TQ","Magn Reson Med","2014","2013/05/30","PMC3783549","NIHMS479174","10.1002/mrm.24797"
"23696219","An embedded four-channel receive-only RF coil array for fMRI experiments of the somatosensory pathway in conscious awake marmosets","Papoti D, Yen CC, Mackel JB, Merkle H, Silva AC.","NMR Biomed. 2013 Nov;26(11):1395-402. doi: 10.1002/nbm.2965. Epub 2013 May 22.","Papoti D","NMR Biomed","2013","2013/05/23","PMC4200535","NIHMS628254","10.1002/nbm.2965"
"23652854","Large-scale reorganization of the somatosensory cortex of adult macaque monkeys revealed by fMRI","Dutta A, Kambi N, Raghunathan P, Khushu S, Jain N.","Brain Struct Funct. 2014 Jul;219(4):1305-20. doi: 10.1007/s00429-013-0569-8. Epub 2013 May 8.","Dutta A","Brain Struct Funct","2014","2013/05/09","","","10.1007/s00429-013-0569-8"
"22855672","Monkey in the middle: why non-human primates are needed to bridge the gap in resting-state investigations","Hutchison RM, Everling S.","Front Neuroanat. 2012 Jul 26;6:29. doi: 10.3389/fnana.2012.00029. eCollection 2012.","Hutchison RM","Front Neuroanat","2012","2012/08/03","PMC3405297","","10.3389/fnana.2012.00029"
"22504764","What does polarity inversion of extrastriate activity tell us about striate contributions to the early VEP? A comment on Ales et al. (2010)","Kelly SP, Schroeder CE, Lalor EC.","Neuroimage. 2013 Aug 1;76:442-5. doi: 10.1016/j.neuroimage.2012.03.081. Epub 2012 Apr 5.","Kelly SP","Neuroimage","2013","2012/04/17","","","10.1016/j.neuroimage.2012.03.081"
"22235303","A functional and structural investigation of the human fronto-basal volitional saccade network","Neggers SF, Diepen RM, Zandbelt BB, Vink M, Mandl RC, Gutteling TP.","PLoS One. 2012;7(1):e29517. doi: 10.1371/journal.pone.0029517. Epub 2012 Jan 3.","Neggers SF","PLoS One","2012","2012/01/12","PMC3250458","","10.1371/journal.pone.0029517"
"21687796","Faces and eyes in human lateral prefrontal cortex","Chan AW, Downing PE.","Front Hum Neurosci. 2011 Jun 2;5:51. doi: 10.3389/fnhum.2011.00051. eCollection 2011.","Chan AW","Front Hum Neurosci","2011","2011/06/21","PMC3108382","","10.3389/fnhum.2011.00051"
"21148091","Integration of visual and tactile signals from the hand in the human brain: an FMRI study","Gentile G, Petkova VI, Ehrsson HH.","J Neurophysiol. 2011 Feb;105(2):910-22. doi: 10.1152/jn.00840.2010. Epub 2010 Dec 8.","Gentile G","J Neurophysiol","2011","2010/12/15","PMC3059180","","10.1152/jn.00840.2010"
"20965262","Where sound position influences sound object representations: a 7-T fMRI study","van der Zwaag W, Gentile G, Gruetter R, Spierer L, Clarke S.","Neuroimage. 2011 Feb 1;54(3):1803-11. doi: 10.1016/j.neuroimage.2010.10.032. Epub 2010 Oct 18.","van der Zwaag W","Neuroimage","2011","2010/10/23","","","10.1016/j.neuroimage.2010.10.032"
"20493828","MEG in the macaque monkey and human: distinguishing cortical fields in space and time","Zumer JM, Nagarajan SS, Krubitzer LA, Zhu Z, Turner RS, Disbrow EA.","Brain Res. 2010 Jul 23;1345:110-24. doi: 10.1016/j.brainres.2010.05.037. Epub 2010 May 20.","Zumer JM","Brain Res","2010","2010/05/25","PMC2899153","NIHMS213622","10.1016/j.brainres.2010.05.037"
"20053384","Characterisation of the BOLD response time course at different levels of the auditory pathway in non-human primates","Baumann S, Griffiths TD, Rees A, Hunter D, Sun L, Thiele A.","Neuroimage. 2010 Apr 15;50(3):1099-108. doi: 10.1016/j.neuroimage.2009.12.103. Epub 2010 Jan 4.","Baumann S","Neuroimage","2010","2010/01/08","PMC2880247","","10.1016/j.neuroimage.2009.12.103"
"19961940","Competition between learned reward and error outcome predictions in anterior cingulate cortex","Alexander WH, Brown JW.","Neuroimage. 2010 Feb 15;49(4):3210-8. doi: 10.1016/j.neuroimage.2009.11.065. Epub 2009 Dec 1.","Alexander WH","Neuroimage","2010","2009/12/08","PMC2818639","NIHMS163734","10.1016/j.neuroimage.2009.11.065"
"18761038","An open-source hardware and software system for acquisition and real-time processing of electrophysiology during high field MRI","Purdon PL, Millan H, Fuller PL, Bonmassar G.","J Neurosci Methods. 2008 Nov 15;175(2):165-86. doi: 10.1016/j.jneumeth.2008.07.017. Epub 2008 Aug 5.","Purdon PL","J Neurosci Methods","2008","2008/09/02","PMC2855223","NIHMS77940","10.1016/j.jneumeth.2008.07.017"
"17889562","Subregions of the ventral striatum show preferential coding of reward magnitude and probability","Yacubian J, Sommer T, Schroeder K, Gläscher J, Braus DF, Büchel C.","Neuroimage. 2007 Nov 15;38(3):557-63. doi: 10.1016/j.neuroimage.2007.08.007. Epub 2007 Aug 22.","Yacubian J","Neuroimage","2007","2007/09/25","","","10.1016/j.neuroimage.2007.08.007"
"17395577","Morphology, language and the brain: the decompositional substrate for language comprehension","Marslen-Wilson WD, Tyler LK.","Philos Trans R Soc Lond B Biol Sci. 2007 May 29;362(1481):823-36. doi: 10.1098/rstb.2007.2091.","Marslen-Wilson WD","Philos Trans R Soc Lond B Biol Sci","2007","2007/03/31","PMC2430000","","10.1098/rstb.2007.2091"
"17208181","Separate coding of different gaze directions in the superior temporal sulcus and inferior parietal lobule","Calder AJ, Beaver JD, Winston JS, Dolan RJ, Jenkins R, Eger E, Henson RN.","Curr Biol. 2007 Jan 9;17(1):20-5. doi: 10.1016/j.cub.2006.10.052.","Calder AJ","Curr Biol","2007","2007/01/09","PMC1885952","","10.1016/j.cub.2006.10.052"
"16675025","fMRI in alert, behaving monkeys: an adaptation of the human infant familiarization novelty preference procedure","Joseph JE, Powell DK, Andersen AH, Bhatt RS, Dunlap MK, Foldes ST, Forman E, Hardy PA, Steinmetz NA, Zhang Z.","J Neurosci Methods. 2006 Oct 15;157(1):10-24. doi: 10.1016/j.jneumeth.2006.03.018. Epub 2006 May 3.","Joseph JE","J Neurosci Methods","2006","2006/05/06","","","10.1016/j.jneumeth.2006.03.018"
"14630229","MR imaging in the non-human primate: studies of function and of dynamic connectivity","Logothetis NK.","Curr Opin Neurobiol. 2003 Oct;13(5):630-42. doi: 10.1016/j.conb.2003.09.017.","Logothetis NK","Curr Opin Neurobiol","2003","2003/11/25","","","10.1016/j.conb.2003.09.017"
"12927334","Neuroimaging studies of priming","Henson RN.","Prog Neurobiol. 2003 May;70(1):53-81. doi: 10.1016/s0301-0082(03)00086-8.","Henson RN","Prog Neurobiol","2003","2003/08/21","","","10.1016/s0301-0082(03)00086-8"
"12221492","High resolution fMRI of ocular dominance columns within the visual cortex of human amblyopes","Goodyear BG, Nicolle DA, Menon RS.","Strabismus. 2002 Jun;10(2):129-36. doi: 10.1076/stra.10.2.129.8140.","Goodyear BG","Strabismus","2002","2002/09/11","","","10.1076/stra.10.2.129.8140"
"12204305","Functional MRI studies in awake rhesus monkeys: methodological and analytical strategies","Andersen AH, Zhang Z, Barber T, Rayens WS, Zhang J, Grondin R, Hardy P, Gerhardt GA, Gash DM.","J Neurosci Methods. 2002 Aug 30;118(2):141-52. doi: 10.1016/s0165-0270(02)00123-1.","Andersen AH","J Neurosci Methods","2002","2002/09/03","","","10.1016/s0165-0270(02)00123-1"
"11726800","Somatotopic organization of the medial wall of the cerebral hemispheres: a 3 Tesla fMRI study","Mayer AR, Zimbelman JL, Watanabe Y, Rao SM.","Neuroreport. 2001 Dec 4;12(17):3811-4. doi: 10.1097/00001756-200112040-00042.","Mayer AR","Neuroreport","2001","2001/12/01","","","10.1097/00001756-200112040-00042"
"11389943","Direct comparison of visual cortex activation in human and non-human primates using functional magnetic resonance imaging","Dubowitz DJ, Chen DY, Atkinson DJ, Scadeng M, Martinez A, Andersen MB, Andersen RA, Bradley WG Jr.","J Neurosci Methods. 2001 May 30;107(1-2):71-80. doi: 10.1016/s0165-0270(01)00353-3.","Dubowitz DJ","J Neurosci Methods","2001","2001/06/08","","","10.1016/s0165-0270(01)00353-3"
"9460087","Superior temporal gyrus and planum temporale in schizophrenia: a selective review","Pearlson GD.","Prog Neuropsychopharmacol Biol Psychiatry. 1997 Nov;21(8):1203-29. doi: 10.1016/s0278-5846(97)00159-0.","Pearlson GD","Prog Neuropsychopharmacol Biol Psychiatry","1997","1998/02/14","","","10.1016/s0278-5846(97)00159-0"
