PMID,Title,Authors,Citation,First Author,Journal/Book,Publication Year,Create Date,PMCID,NIHMS ID,DOI
"24478378","Dissociable memory traces within the macaque medial temporal lobe predict subsequent recognition performance","Miyamoto K, Adachi Y, Osada T, Watanabe T, Kimura HM, Setsuie R, Miyashita Y.","J Neurosci. 2014 Jan 29;34(5):1988-97. doi: 10.1523/JNEUROSCI.4048-13.2014.","Miyamoto K","J Neurosci","2014","2014/01/31","PMC6827594","","10.1523/JNEUROSCI.4048-13.2014"
"24453305","A hierarchy of responses to auditory regularities in the macaque brain","Uhrig L, Dehaene S, Jarraya B.","J Neurosci. 2014 Jan 22;34(4):1127-32. doi: 10.1523/JNEUROSCI.3165-13.2014.","Uhrig L","J Neurosci","2014","2014/01/24","PMC5635960","EMS74429","10.1523/JNEUROSCI.3165-13.2014"
"24164166","Graphs of brain networks","Zahr NM.","Alcohol Clin Exp Res. 2013 Nov;37(11):1813-5. doi: 10.1111/acer.12293.","Zahr NM","Alcohol Clin Exp Res","2013","2013/10/30","PMC8146133","NIHMS1699229","10.1111/acer.12293"
"24068551","Large-scale brain networks of the human left temporal pole: a functional connectivity MRI study","Pascual B, Masdeu JC, Hollenbeck M, Makris N, Insausti R, Ding SL, Dickerson BC.","Cereb Cortex. 2015 Mar;25(3):680-702. doi: 10.1093/cercor/bht260. Epub 2013 Sep 24.","Pascual B","Cereb Cortex","2015","2013/09/27","PMC4318532","","10.1093/cercor/bht260"
"23928747","Multi-region hemispheric specialization differentiates human from nonhuman primate brain function","Wey HY, Phillips KA, McKay DR, Laird AR, Kochunov P, Davis MD, Glahn DC, Blangero J, Duong TQ, Fox PT.","Brain Struct Funct. 2014 Nov;219(6):2187-94. doi: 10.1007/s00429-013-0620-9. Epub 2013 Aug 9.","Wey HY","Brain Struct Funct","2014","2013/08/10","PMC4219928","NIHMS638709","10.1007/s00429-013-0620-9"
"23905720","The effects of alcohol on the nonhuman primate brain: a network science approach to neuroimaging","Telesford QK, Laurienti PJ, Friedman DP, Kraft RA, Daunais JB.","Alcohol Clin Exp Res. 2013 Nov;37(11):1891-900. doi: 10.1111/acer.12181. Epub 2013 Jul 26.","Telesford QK","Alcohol Clin Exp Res","2013","2013/08/03","PMC3812370","NIHMS471410","10.1111/acer.12181"
"23873674","""What?"" and ""where?"" versus ""what is where?"": the impact of task on coding of object form and position in the lateral occipital complex","Macevoy SP.","J Vis. 2013 Jul 19;13(8):21. doi: 10.1167/13.8.21.","Macevoy SP","J Vis","2013","2013/07/23","","","10.1167/13.8.21"
"23788461","Minimizing biases in estimating the reorganization of human visual areas with BOLD retinotopic mapping","Binda P, Thomas JM, Boynton GM, Fine I.","J Vis. 2013 Jun 20;13(7):13. doi: 10.1167/13.7.13.","Binda P","J Vis","2013","2013/06/22","PMC3689563","","10.1167/13.7.13"
"23773004","A method for conducting functional MRI studies in alert nonhuman primates: initial results with opioid agonists in male cynomolgus monkeys","Kaufman MJ, Janes AC, Frederick Bd, Brimson-Théberge M, Tong Y, McWilliams SB, Bear A, Gillis TE, Schrode KM, Renshaw PF, Negus SS.","Exp Clin Psychopharmacol. 2013 Aug;21(4):323-31. doi: 10.1037/a0033062. Epub 2013 Jun 17.","Kaufman MJ","Exp Clin Psychopharmacol","2013","2013/06/19","PMC3916219","NIHMS546580","10.1037/a0033062"
"23723346","Neurovascular coupling to D2/D3 dopamine receptor occupancy using simultaneous PET/functional MRI","Sander CY, Hooker JM, Catana C, Normandin MD, Alpert NM, Knudsen GM, Vanduffel W, Rosen BR, Mandeville JB.","Proc Natl Acad Sci U S A. 2013 Jul 2;110(27):11169-74. doi: 10.1073/pnas.1220512110. Epub 2013 May 30.","Sander CY","Proc Natl Acad Sci U S A","2013","2013/06/01","PMC3703969","","10.1073/pnas.1220512110"
"23585519","The pathways for intelligible speech: multivariate and univariate perspectives","Evans S, Kyong JS, Rosen S, Golestani N, Warren JE, McGettigan C, Mourão-Miranda J, Wise RJ, Scott SK.","Cereb Cortex. 2014 Sep;24(9):2350-61. doi: 10.1093/cercor/bht083. Epub 2013 Apr 12.","Evans S","Cereb Cortex","2014","2013/04/16","PMC4128702","","10.1093/cercor/bht083"
"23513045","Dissociable functional networks of the human dentate nucleus","Bernard JA, Peltier SJ, Benson BL, Wiggins JL, Jaeggi SM, Buschkuehl M, Jonides J, Monk CS, Seidler RD.","Cereb Cortex. 2014 Aug;24(8):2151-9. doi: 10.1093/cercor/bht065. Epub 2013 Mar 19.","Bernard JA","Cereb Cortex","2014","2013/03/21","PMC4089384","","10.1093/cercor/bht065"
"23460411","Representational demands modulate involvement of perirhinal cortex in face processing","O'Neil EB, Barkley VA, Köhler S.","Hippocampus. 2013 Jul;23(7):592-605. doi: 10.1002/hipo.22117. Epub 2013 Apr 12.","O'Neil EB","Hippocampus","2013","2013/03/06","","","10.1002/hipo.22117"
"23447621","Multimodal convergence within the intraparietal sulcus of the macaque monkey","Guipponi O, Wardak C, Ibarrola D, Comte JC, Sappey-Marinier D, Pinède S, Ben Hamed S.","J Neurosci. 2013 Feb 27;33(9):4128-39. doi: 10.1523/JNEUROSCI.1421-12.2013.","Guipponi O","J Neurosci","2013","2013/03/01","PMC6619317","","10.1523/JNEUROSCI.1421-12.2013"
"23365237","Where one hand meets the other: limb-specific and action-dependent movement plans decoded from preparatory signals in single human frontoparietal brain areas","Gallivan JP, McLean DA, Flanagan JR, Culham JC.","J Neurosci. 2013 Jan 30;33(5):1991-2008. doi: 10.1523/JNEUROSCI.0541-12.2013.","Gallivan JP","J Neurosci","2013","2013/02/01","PMC6619126","","10.1523/JNEUROSCI.0541-12.2013"
"23077051","Dynamic reorganization of digit representations in somatosensory cortex of nonhuman primates after spinal cord injury","Chen LM, Qi HX, Kaas JH.","J Neurosci. 2012 Oct 17;32(42):14649-63. doi: 10.1523/JNEUROSCI.1841-12.2012.","Chen LM","J Neurosci","2012","2012/10/19","PMC3498942","NIHMS416090","10.1523/JNEUROSCI.1841-12.2012"
"23042731","Meta-analytic connectivity modeling reveals differential functional connectivity of the medial and lateral orbitofrontal cortex","Zald DH, McHugo M, Ray KL, Glahn DC, Eickhoff SB, Laird AR.","Cereb Cortex. 2014 Jan;24(1):232-48. doi: 10.1093/cercor/bhs308. Epub 2012 Oct 4.","Zald DH","Cereb Cortex","2014","2012/10/09","PMC3862271","","10.1093/cercor/bhs308"
"22965769","Human finger somatotopy in areas 3b, 1, and 2: a 7T fMRI study using a natural stimulus","Martuzzi R, van der Zwaag W, Farthouat J, Gruetter R, Blanke O.","Hum Brain Mapp. 2014 Jan;35(1):213-26. doi: 10.1002/hbm.22172. Epub 2012 Sep 11.","Martuzzi R","Hum Brain Mapp","2014","2012/09/12","PMC6869627","","10.1002/hbm.22172"
"22849405","Neurodynamics of cognitive set shifting in monkey frontal cortex and its causal impact on behavioral flexibility","Kamigaki T, Fukushima T, Tamura K, Miyashita Y.","J Cogn Neurosci. 2012 Nov;24(11):2171-85. doi: 10.1162/jocn_a_00277. Epub 2012 Jul 31.","Kamigaki T","J Cogn Neurosci","2012","2012/08/02","","","10.1162/jocn_a_00277"
"22836258","Unravelling the intrinsic functional organization of the human lateral frontal cortex: a parcellation scheme based on resting state fMRI","Goulas A, Uylings HB, Stiers P.","J Neurosci. 2012 Jul 25;32(30):10238-52. doi: 10.1523/JNEUROSCI.5852-11.2012.","Goulas A","J Neurosci","2012","2012/07/28","PMC6703746","","10.1523/JNEUROSCI.5852-11.2012"
"22492028","Direct evidence for domain-sensitive functional subregions in human entorhinal cortex","Schultz H, Sommer T, Peters J.","J Neurosci. 2012 Apr 4;32(14):4716-23. doi: 10.1523/JNEUROSCI.5126-11.2012.","Schultz H","J Neurosci","2012","2012/04/12","PMC6620910","","10.1523/JNEUROSCI.5126-11.2012"
"22253658","Methods for fine scale functional imaging of tactile motion in human and nonhuman primates","Friedman RM, Dillenburger BC, Wang F, Avison MJ, Gore JC, Roe AW, Chen LM.","Open Neuroimag J. 2011;5:160-71. doi: 10.2174/1874440001105010160. Epub 2011 Nov 18.","Friedman RM","Open Neuroimag J","2011","2012/01/19","PMC3257843","","10.2174/1874440001105010160"
"22115923","Differential fMRI activation to noxious heat and tactile stimuli in parasylvian areas of new world monkeys","Chen LM, Dillenburger BC, Wang F, Tang CH.","Pain. 2012 Jan;153(1):158-169. doi: 10.1016/j.pain.2011.10.006. Epub 2011 Nov 23.","Chen LM","Pain","2012","2011/11/26","PMC3245780","NIHMS332815","10.1016/j.pain.2011.10.006"
"22114283","Decoding effector-dependent and effector-independent movement intentions from human parieto-frontal brain activity","Gallivan JP, McLean DA, Smith FW, Culham JC.","J Neurosci. 2011 Nov 23;31(47):17149-68. doi: 10.1523/JNEUROSCI.1058-11.2011.","Gallivan JP","J Neurosci","2011","2011/11/25","PMC6623835","","10.1523/JNEUROSCI.1058-11.2011"
"22040739","Ongoing physiological processes in the cerebral cortex","Leopold DA, Maier A.","Neuroimage. 2012 Oct 1;62(4):2190-200. doi: 10.1016/j.neuroimage.2011.10.059. Epub 2011 Oct 25.","Leopold DA","Neuroimage","2012","2011/11/02","PMC3288739","NIHMS334847","10.1016/j.neuroimage.2011.10.059"
"21957240","Scene-selective cortical regions in human and nonhuman primates","Nasr S, Liu N, Devaney KJ, Yue X, Rajimehr R, Ungerleider LG, Tootell RB.","J Neurosci. 2011 Sep 28;31(39):13771-85. doi: 10.1523/JNEUROSCI.2792-11.2011.","Nasr S","J Neurosci","2011","2011/09/30","PMC3489186","NIHMS328321","10.1523/JNEUROSCI.2792-11.2011"
"21865466","Relationship between functional magnetic resonance imaging-identified regions and neuronal category selectivity","Bell AH, Malecek NJ, Morin EL, Hadj-Bouziane F, Tootell RB, Ungerleider LG.","J Neurosci. 2011 Aug 24;31(34):12229-40. doi: 10.1523/JNEUROSCI.5865-10.2011.","Bell AH","J Neurosci","2011","2011/08/26","PMC3165163","NIHMS317613","10.1523/JNEUROSCI.5865-10.2011"
"21715625","Decoding action intentions from preparatory brain activity in human parieto-frontal networks","Gallivan JP, McLean DA, Valyear KF, Pettypiece CE, Culham JC.","J Neurosci. 2011 Jun 29;31(26):9599-610. doi: 10.1523/JNEUROSCI.0080-11.2011.","Gallivan JP","J Neurosci","2011","2011/07/01","PMC6623162","","10.1523/JNEUROSCI.0080-11.2011"
"21677185","FMRI adaptation reveals a cortical mechanism for the coding of space near the hand","Brozzoli C, Gentile G, Petkova VI, Ehrsson HH.","J Neurosci. 2011 Jun 15;31(24):9023-31. doi: 10.1523/JNEUROSCI.1172-11.2011.","Brozzoli C","J Neurosci","2011","2011/06/17","PMC6622953","","10.1523/JNEUROSCI.1172-11.2011"
"21664781","Realignment strategies for awake-monkey fMRI data","Stoewer S, Goense J, Keliris GA, Bartels A, Logothetis NK, Duncan J, Sigala N.","Magn Reson Imaging. 2011 Dec;29(10):1390-400. doi: 10.1016/j.mri.2011.05.003. Epub 2011 Jun 12.","Stoewer S","Magn Reson Imaging","2011","2011/06/14","","","10.1016/j.mri.2011.05.003"
"21530264","Subjective socioeconomic status predicts human ventral striatal responses to social status information","Ly M, Haynes MR, Barter JW, Weinberger DR, Zink CF.","Curr Biol. 2011 May 10;21(9):794-7. doi: 10.1016/j.cub.2011.03.050. Epub 2011 Apr 28.","Ly M","Curr Biol","2011","2011/05/03","","","10.1016/j.cub.2011.03.050"
"21317354","Nonhuman primate positron emission tomography neuroimaging in drug abuse research","Howell LL, Murnane KS.","J Pharmacol Exp Ther. 2011 May;337(2):324-34. doi: 10.1124/jpet.108.136689. Epub 2011 Feb 11.","Howell LL","J Pharmacol Exp Ther","2011","2011/02/15","PMC3083112","","10.1124/jpet.108.136689"
"21265603","Functional connectivity and coactivation of the nucleus accumbens: a combined functional connectivity and structure-based meta-analysis","Cauda F, Cavanna AE, D'agata F, Sacco K, Duca S, Geminiani GC.","J Cogn Neurosci. 2011 Oct;23(10):2864-77. doi: 10.1162/jocn.2011.21624. Epub 2011 Jan 25.","Cauda F","J Cogn Neurosci","2011","2011/01/27","","","10.1162/jocn.2011.21624"
"20827260","Baseline CBF, and BOLD, CBF, and CMRO2 fMRI of visual and vibrotactile stimulations in baboons","Wey HY, Wang DJ, Duong TQ.","J Cereb Blood Flow Metab. 2011 Feb;31(2):715-24. doi: 10.1038/jcbfm.2010.154. Epub 2010 Sep 8.","Wey HY","J Cereb Blood Flow Metab","2011","2010/09/10","PMC3049525","","10.1038/jcbfm.2010.154"
"20579829","Integration of EEG source imaging and fMRI during continuous viewing of natural movies","Whittingstall K, Bartels A, Singh V, Kwon S, Logothetis NK.","Magn Reson Imaging. 2010 Oct;28(8):1135-42. doi: 10.1016/j.mri.2010.03.042. Epub 2010 Jun 25.","Whittingstall K","Magn Reson Imaging","2010","2010/06/29","","","10.1016/j.mri.2010.03.042"
"20433244","High-resolution fMRI reveals match enhancement and attentional modulation in the human medial temporal lobe","Dudukovic NM, Preston AR, Archie JJ, Glover GH, Wagner AD.","J Cogn Neurosci. 2011 Mar;23(3):670-82. doi: 10.1162/jocn.2010.21509. Epub 2010 Apr 30.","Dudukovic NM","J Cogn Neurosci","2011","2010/05/04","PMC5746189","NIHMS928159","10.1162/jocn.2010.21509"
"20164324","fMRI-Guided transcranial magnetic stimulation reveals that the superior temporal sulcus is a cortical locus of the McGurk effect","Beauchamp MS, Nath AR, Pasalar S.","J Neurosci. 2010 Feb 17;30(7):2414-7. doi: 10.1523/JNEUROSCI.4865-09.2010.","Beauchamp MS","J Neurosci","2010","2010/02/19","PMC2844713","NIHMS179272","10.1523/JNEUROSCI.4865-09.2010"
"19803682","Heterogeneous structure in face-selective human occipito-temporal cortex","Betts LR, Wilson HR.","J Cogn Neurosci. 2010 Oct;22(10):2276-88. doi: 10.1162/jocn.2009.21346.","Betts LR","J Cogn Neurosci","2010","2009/10/07","","","10.1162/jocn.2009.21346"
"19386635","Integrating visual and tactile information in the perirhinal cortex","Holdstock JS, Hocking J, Notley P, Devlin JT, Price CJ.","Cereb Cortex. 2009 Dec;19(12):2993-3000. doi: 10.1093/cercor/bhp073. Epub 2009 Apr 22.","Holdstock JS","Cereb Cortex","2009","2009/04/24","PMC2774401","","10.1093/cercor/bhp073"
"19239700","Orienting asymmetries and lateralized processing of sounds in humans","Fischer J, Teufel C, Drolet M, Patzelt A, Rübsamen R, von Cramon DY, Schubotz RI.","BMC Neurosci. 2009 Feb 24;10:14. doi: 10.1186/1471-2202-10-14.","Fischer J","BMC Neurosci","2009","2009/02/26","PMC2652465","","10.1186/1471-2202-10-14"
"19179278","An anterior temporal face patch in human cortex, predicted by macaque maps","Rajimehr R, Young JC, Tootell RB.","Proc Natl Acad Sci U S A. 2009 Feb 10;106(6):1995-2000. doi: 10.1073/pnas.0807304106. Epub 2009 Jan 28.","Rajimehr R","Proc Natl Acad Sci U S A","2009","2009/01/31","PMC2632713","","10.1073/pnas.0807304106"
"19138749","BOLD fMRI activation for anti-saccades in nonhuman primates","Ford KA, Gati JS, Menon RS, Everling S.","Neuroimage. 2009 Apr 1;45(2):470-6. doi: 10.1016/j.neuroimage.2008.12.009. Epub 2008 Dec 24.","Ford KA","Neuroimage","2009","2009/01/14","","","10.1016/j.neuroimage.2008.12.009"
"19074351","Modafinil shifts human locus coeruleus to low-tonic, high-phasic activity during functional MRI","Minzenberg MJ, Watrous AJ, Yoon JH, Ursu S, Carter CS.","Science. 2008 Dec 12;322(5908):1700-2. doi: 10.1126/science.1164908.","Minzenberg MJ","Science","2008","2008/12/17","","","10.1126/science.1164908"
"18971297","Development of working memory maintenance","Geier CF, Garver K, Terwilliger R, Luna B.","J Neurophysiol. 2009 Jan;101(1):84-99. doi: 10.1152/jn.90562.2008. Epub 2008 Oct 29.","Geier CF","J Neurophysiol","2009","2008/10/31","PMC2637004","","10.1152/jn.90562.2008"
"18701759","Intrinsic functional relations between human cerebral cortex and thalamus","Zhang D, Snyder AZ, Fox MD, Sansbury MW, Shimony JS, Raichle ME.","J Neurophysiol. 2008 Oct;100(4):1740-8. doi: 10.1152/jn.90463.2008. Epub 2008 Aug 13.","Zhang D","J Neurophysiol","2008","2008/08/15","PMC2576214","","10.1152/jn.90463.2008"
"18493928","Multiple signals of recognition memory in the medial temporal lobe","Yassa MA, Stark CE.","Hippocampus. 2008;18(9):945-54. doi: 10.1002/hipo.20452.","Yassa MA","Hippocampus","2008","2008/05/22","","","10.1002/hipo.20452"
"18372289","Functional lateralization of face, hand, and trunk representation in anatomically defined human somatosensory areas","Eickhoff SB, Grefkes C, Fink GR, Zilles K.","Cereb Cortex. 2008 Dec;18(12):2820-30. doi: 10.1093/cercor/bhn039. Epub 2008 Mar 27.","Eickhoff SB","Cereb Cortex","2008","2008/03/29","PMC2724832","","10.1093/cercor/bhn039"
"18172338","High-resolution fMRI maps of cortical activation in nonhuman primates: correlation with intrinsic signal optical images","Roe AW, Chen LM.","ILAR J. 2008;49(1):116-23. doi: 10.1093/ilar.49.1.116.","Roe AW","ILAR J","2008","2008/01/04","PMC2653868","NIHMS94976","10.1093/ilar.49.1.116"
"18054173","Three-dimensional probabilistic maps of the occipital sulci of the human brain in standardized stereotaxic space","Iaria G, Robbins S, Petrides M.","Neuroscience. 2008 Jan 2;151(1):174-85. doi: 10.1016/j.neuroscience.2007.09.050. Epub 2007 Nov 28.","Iaria G","Neuroscience","2008","2007/12/07","","","10.1016/j.neuroscience.2007.09.050"
"17960143","The effect of labeling parameters on perfusion-based fMRI in nonhuman primates","Zappe AC, Pfeuffer J, Merkle H, Logothetis NK, Goense JB.","J Cereb Blood Flow Metab. 2008 Mar;28(3):640-52. doi: 10.1038/sj.jcbfm.9600564. Epub 2007 Oct 24.","Zappe AC","J Cereb Blood Flow Metab","2008","2007/10/26","","","10.1038/sj.jcbfm.9600564"
"17896395","MRI of spontaneous fluctuations after acute cerebral ischemia in nonhuman primates","Liu Y, D'Arceuil H, He J, Duggan M, Gonzalez G, Pryor J, de Crespigny A.","J Magn Reson Imaging. 2007 Oct;26(4):1112-6. doi: 10.1002/jmri.21131.","Liu Y","J Magn Reson Imaging","2007","2007/09/27","","","10.1002/jmri.21131"
"17715354","High-resolution maps of real and illusory tactile activation in primary somatosensory cortex in individual monkeys with functional magnetic resonance imaging and optical imaging","Chen LM, Turner GH, Friedman RM, Zhang N, Gore JC, Roe AW, Avison MJ.","J Neurosci. 2007 Aug 22;27(34):9181-91. doi: 10.1523/JNEUROSCI.1588-07.2007.","Chen LM","J Neurosci","2007","2007/08/24","PMC6672200","","10.1523/JNEUROSCI.1588-07.2007"
"17689575","Human cortical representation of oral temperature","Guest S, Grabenhorst F, Essick G, Chen Y, Young M, McGlone F, de Araujo I, Rolls ET.","Physiol Behav. 2007 Dec 5;92(5):975-84. doi: 10.1016/j.physbeh.2007.07.004. Epub 2007 Jul 13.","Guest S","Physiol Behav","2007","2007/08/11","","","10.1016/j.physbeh.2007.07.004"
"17499170","fMRI studies of eye movement control: investigating the interaction of cognitive and sensorimotor brain systems","Sweeney JA, Luna B, Keedy SK, McDowell JE, Clementz BA.","Neuroimage. 2007;36 Suppl 2(Suppl 2):T54-60. doi: 10.1016/j.neuroimage.2007.03.018. Epub 2007 Mar 27.","Sweeney JA","Neuroimage","2007","2007/05/15","PMC2692203","NIHMS24134","10.1016/j.neuroimage.2007.03.018"
"17497631","Localization of human intraparietal areas AIP, CIP, and LIP using surface orientation and saccadic eye movement tasks","Shikata E, McNamara A, Sprenger A, Hamzei F, Glauche V, Büchel C, Binkofski F.","Hum Brain Mapp. 2008 Apr;29(4):411-21. doi: 10.1002/hbm.20396.","Shikata E","Hum Brain Mapp","2008","2007/05/15","PMC6870972","","10.1002/hbm.20396"
"16950163","The radial bias: a different slant on visual orientation sensitivity in human and nonhuman primates","Sasaki Y, Rajimehr R, Kim BW, Ekstrom LB, Vanduffel W, Tootell RB.","Neuron. 2006 Sep 7;51(5):661-70. doi: 10.1016/j.neuron.2006.07.021.","Sasaki Y","Neuron","2006","2006/09/05","","","10.1016/j.neuron.2006.07.021"
"16928798","Integration of target and effector information in the human brain during reach planning","Beurze SM, de Lange FP, Toni I, Medendorp WP.","J Neurophysiol. 2007 Jan;97(1):188-99. doi: 10.1152/jn.00456.2006. Epub 2006 Aug 23.","Beurze SM","J Neurophysiol","2007","2006/08/25","","","10.1152/jn.00456.2006"
"16281284","Identifying human parieto-insular vestibular cortex using fMRI and cytoarchitectonic mapping","Eickhoff SB, Weiss PH, Amunts K, Fink GR, Zilles K.","Hum Brain Mapp. 2006 Jul;27(7):611-21. doi: 10.1002/hbm.20205.","Eickhoff SB","Hum Brain Mapp","2006","2005/11/11","PMC6871353","","10.1002/hbm.20205"
"15944234","Visual responses of the human superior colliculus: a high-resolution functional magnetic resonance imaging study","Schneider KA, Kastner S.","J Neurophysiol. 2005 Oct;94(4):2491-503. doi: 10.1152/jn.00288.2005. Epub 2005 Jun 8.","Schneider KA","J Neurophysiol","2005","2005/06/10","","","10.1152/jn.00288.2005"
"15849896","Integrating rewards and cognition in the frontal cortex","Gilbert AM, Fiez JA.","Cogn Affect Behav Neurosci. 2004 Dec;4(4):540-52. doi: 10.3758/cabn.4.4.540.","Gilbert AM","Cogn Affect Behav Neurosci","2004","2005/04/27","","","10.3758/cabn.4.4.540"
"15827999","Bilateral cortical representation of the trunk midline in human first somatic sensory area","Fabri M, Polonara G, Salvolini U, Manzoni T.","Hum Brain Mapp. 2005 Jul;25(3):287-96. doi: 10.1002/hbm.20099.","Fabri M","Hum Brain Mapp","2005","2005/04/14","PMC6871704","","10.1002/hbm.20099"
"15710884","Symmetry activates extrastriate visual cortex in human and nonhuman primates","Sasaki Y, Vanduffel W, Knutsen T, Tyler C, Tootell R.","Proc Natl Acad Sci U S A. 2005 Feb 22;102(8):3159-63. doi: 10.1073/pnas.0500319102. Epub 2005 Feb 14.","Sasaki Y","Proc Natl Acad Sci U S A","2005","2005/02/16","PMC549500","","10.1073/pnas.0500319102"
"15601517","Response-selection-related parietal activation during number comparison","Göbel SM, Johansen-Berg H, Behrens T, Rushworth MF.","J Cogn Neurosci. 2004 Nov;16(9):1536-51. doi: 10.1162/0898929042568442.","Göbel SM","J Cogn Neurosci","2004","2004/12/17","","","10.1162/0898929042568442"
"15488396","Distributed digit somatotopy in primary somatosensory cortex","Overduin SA, Servos P.","Neuroimage. 2004 Oct;23(2):462-72. doi: 10.1016/j.neuroimage.2004.06.024.","Overduin SA","Neuroimage","2004","2004/10/19","","","10.1016/j.neuroimage.2004.06.024"
"15110033","Assessing the auditory dual-pathway model in humans","Arnott SR, Binns MA, Grady CL, Alain C.","Neuroimage. 2004 May;22(1):401-8. doi: 10.1016/j.neuroimage.2004.01.014.","Arnott SR","Neuroimage","2004","2004/04/28","","","10.1016/j.neuroimage.2004.01.014"
"15072671","Processing objects at different levels of specificity","Tyler LK, Stamatakis EA, Bright P, Acres K, Abdallah S, Rodd JM, Moss HE.","J Cogn Neurosci. 2004 Apr;16(3):351-62. doi: 10.1162/089892904322926692.","Tyler LK","J Cogn Neurosci","2004","2004/04/10","","","10.1162/089892904322926692"
"15068921","Brain network interactions in auditory, visual and linguistic processing","Horwitz B, Braun AR.","Brain Lang. 2004 May;89(2):377-84. doi: 10.1016/S0093-934X(03)00349-3.","Horwitz B","Brain Lang","2004","2004/04/08","","","10.1016/S0093-934X(03)00349-3"
"14960288","Event-related functional magnetic resonance imaging of reward-related brain circuitry in children and adolescents","May JC, Delgado MR, Dahl RE, Stenger VA, Ryan ND, Fiez JA, Carter CS.","Biol Psychiatry. 2004 Feb 15;55(4):359-66. doi: 10.1016/j.biopsych.2003.11.008.","May JC","Biol Psychiatry","2004","2004/02/13","","","10.1016/j.biopsych.2003.11.008"
"14527586","Functional brain imaging of olfactory processing in monkeys","Boyett-Anderson JM, Lyons DM, Reiss AL, Schatzberg AF, Menon V.","Neuroimage. 2003 Sep;20(1):257-64. doi: 10.1016/s1053-8119(03)00288-x.","Boyett-Anderson JM","Neuroimage","2003","2003/10/07","","","10.1016/s1053-8119(03)00288-x"
"12718849","Principles of pleasure prediction: specifying the neural dynamics of human reward learning","Braver TS, Brown JW.","Neuron. 2003 Apr 24;38(2):150-2. doi: 10.1016/s0896-6273(03)00230-7.","Braver TS","Neuron","2003","2003/04/30","","","10.1016/s0896-6273(03)00230-7"
"12625459","Encoding of novel picture pairs activates the perirhinal cortex: an fMRI study","Pihlajamäki M, Tanila H, Hänninen T, Könönen M, Mikkonen M, Jalkanen V, Partanen K, Aronen HJ, Soininen H.","Hippocampus. 2003;13(1):67-80. doi: 10.1002/hipo.10049.","Pihlajamäki M","Hippocampus","2003","2003/03/11","","","10.1002/hipo.10049"
"12611944","Neural basis of visually guided head movements studied with fMRI","Petit L, Beauchamp MS.","J Neurophysiol. 2003 May;89(5):2516-27. doi: 10.1152/jn.00988.2002. Epub 2003 Jan 29.","Petit L","J Neurophysiol","2003","2003/03/04","","","10.1152/jn.00988.2002"
"12414256","Is it tonotopy after all?","Schönwiesner M, von Cramon DY, Rübsamen R.","Neuroimage. 2002 Nov;17(3):1144-61. doi: 10.1006/nimg.2002.1250.","Schönwiesner M","Neuroimage","2002","2002/11/05","","","10.1006/nimg.2002.1250"
"12126506","Sustained mnemonic response in the human middle frontal gyrus during on-line storage of spatial memoranda","Leung HC, Gore JC, Goldman-Rakic PS.","J Cogn Neurosci. 2002 May 15;14(4):659-71. doi: 10.1162/08989290260045882.","Leung HC","J Cogn Neurosci","2002","2002/07/20","","","10.1162/08989290260045882"
"12030817","Repeated fMRI using iron oxide contrast agent in awake, behaving macaques at 3 Tesla","Leite FP, Tsao D, Vanduffel W, Fize D, Sasaki Y, Wald LL, Dale AM, Kwong KK, Orban GA, Rosen BR, Tootell RB, Mandeville JB.","Neuroimage. 2002 Jun;16(2):283-94. doi: 10.1006/nimg.2002.1110.","Leite FP","Neuroimage","2002","2002/05/29","","","10.1006/nimg.2002.1110"
"11832220","Dissociations within association cortex","Culham J.","Neuron. 2002 Jan 31;33(3):318-20. doi: 10.1016/s0896-6273(02)00584-6.","Culham J","Neuron","2002","2002/02/08","","","10.1016/s0896-6273(02)00584-6"
"11530838","Medial temporal and prefrontal contributions to working memory tasks with novel and familiar stimuli","Stern CE, Sherman SJ, Kirchhoff BA, Hasselmo ME.","Hippocampus. 2001;11(4):337-46. doi: 10.1002/hipo.1048.","Stern CE","Hippocampus","2001","2001/09/04","","","10.1002/hipo.1048"
"11496106","Enhancing fMRI contrast in awake-behaving primates using intravascular magnetite dextran nanopartieles","Dubowitz DJ, Bernheim KA, Chen DY, Bradley WG Jr, Andersen RA.","Neuroreport. 2001 Aug 8;12(11):2335-40. doi: 10.1097/00001756-200108080-00011.","Dubowitz DJ","Neuroreport","2001","2001/08/10","","","10.1097/00001756-200108080-00011"
