PMID,Title,Authors,Citation,First Author,Journal/Book,Publication Year,Create Date,PMCID,NIHMS ID,DOI
"11467916","Detection of audio-visual integration sites in humans by application of electrophysiological criteria to the BOLD effect","Calvert GA, Hansen PC, Iversen SD, Brammer MJ.","Neuroimage. 2001 Aug;14(2):427-38. doi: 10.1006/nimg.2001.0812.","Calvert GA","Neuroimage","2001","2001/07/27","","","10.1006/nimg.2001.0812"
"11224904","Hierarchical organization of the human auditory cortex revealed by functional magnetic resonance imaging","Wessinger CM, VanMeter J, Tian B, Van Lare J, Pekar J, Rauschecker JP.","J Cogn Neurosci. 2001 Jan 1;13(1):1-7. doi: 10.1162/089892901564108.","Wessinger CM","J Cogn Neurosci","2001","2001/02/27","","","10.1162/089892901564108"
"11144756","Broca's region subserves imagery of motion: a combined cytoarchitectonic and fMRI study","Binkofski F, Amunts K, Stephan KM, Posse S, Schormann T, Freund HJ, Zilles K, Seitz RJ.","Hum Brain Mapp. 2000 Dec;11(4):273-85. doi: 10.1002/1097-0193(200012)11:4<273::aid-hbm40>3.0.co;2-0.","Binkofski F","Hum Brain Mapp","2000","2001/01/06","PMC6872088","","10.1002/1097-0193(200012)11:4<273::aid-hbm40>3.0.co;2-0"
"10619415","Cortical networks subserving pursuit and saccadic eye movements in humans: an FMRI study","Berman RA, Colby CL, Genovese CR, Voyvodic JT, Luna B, Thulborn KR, Sweeney JA.","Hum Brain Mapp. 1999;8(4):209-25. doi: 10.1002/(sici)1097-0193(1999)8:4<209::aid-hbm5>3.0.co;2-0.","Berman RA","Hum Brain Mapp","1999","2000/01/05","PMC6873313","","10.1002/(sici)1097-0193(1999)8:4<209::aid-hbm5>3.0.co;2-0"
"10350543","The use of fMRI for determining the topographic organization of cortical fields in human and nonhuman primates","Disbrow E, Roberts TP, Slutsky D, Krubitzer L.","Brain Res. 1999 May 22;829(1-2):167-73. doi: 10.1016/s0006-8993(99)01297-4.","Disbrow E","Brain Res","1999","1999/06/03","","","10.1016/s0006-8993(99)01297-4"
"10227627","Neural pathways in tactile object recognition","Deibert E, Kraut M, Kremen S, Hart J Jr.","Neurology. 1999 Apr 22;52(7):1413-7. doi: 10.1212/wnl.52.7.1413.","Deibert E","Neurology","1999","1999/05/05","","","10.1212/wnl.52.7.1413"
"9698575","The time course of changes during motor sequence learning: a whole-brain fMRI study","Toni I, Krams M, Turner R, Passingham RE.","Neuroimage. 1998 Jul;8(1):50-61. doi: 10.1006/nimg.1998.0349.","Toni I","Neuroimage","1998","1998/08/12","","","10.1006/nimg.1998.0349"
"9655492","fMRI of monkey visual cortex","Stefanacci L, Reber P, Costanza J, Wong E, Buxton R, Zola S, Squire L, Albright T.","Neuron. 1998 Jun;20(6):1051-7. doi: 10.1016/s0896-6273(00)80485-7.","Stefanacci L","Neuron","1998","1998/07/09","","","10.1016/s0896-6273(00)80485-7"
"9635201","Brain mapping in animals and humans","Sereno MI.","Curr Opin Neurobiol. 1998 Apr;8(2):188-94. doi: 10.1016/s0959-4388(98)80139-6.","Sereno MI","Curr Opin Neurobiol","1998","1998/06/23","","","10.1016/s0959-4388(98)80139-6"
"9153483","Object shape processing in the visual system evaluated using functional MRI","Kraut M, Hart J Jr, Soher BJ, Gordon B.","Neurology. 1997 May;48(5):1416-20. doi: 10.1212/wnl.48.5.1416.","Kraut M","Neurology","1997","1997/05/01","","","10.1212/wnl.48.5.1416"
"20408207","Tonotopy in human auditory cortex examined with functional magnetic resonance imaging","Wessinger CM, Buonocore MH, Kussmaul CL, Mangun GR.","Hum Brain Mapp. 1997;5(1):18-25. doi: 10.1002/(SICI)1097-0193(1997)5:1<18::AID-HBM3>3.0.CO;2-Q.","Wessinger CM","Hum Brain Mapp","1997","2010/04/22","","","10.1002/(SICI)1097-0193(1997)5:1<18::AID-HBM3>3.0.CO;2-Q"
"7722658","Functional analysis of human MT and related visual cortical areas using magnetic resonance imaging","Tootell RB, Reppas JB, Kwong KK, Malach R, Born RT, Brady TJ, Rosen BR, Belliveau JW.","J Neurosci. 1995 Apr;15(4):3215-30. doi: 10.1523/JNEUROSCI.15-04-03215.1995.","Tootell RB","J Neurosci","1995","1995/04/01","PMC6577785","","10.1523/JNEUROSCI.15-04-03215.1995"
